,publish_date,headline_category,headline_text
1757,20010217,unknown,Trial by Numbers
1758,20010217,unknown,Fame for Sale
1759,20010217,unknown,Sri Lanka Today
1760,20010217,unknown,A Resort Within the Mind; All Your Own
1761,20010217,unknown,Tea at Aler
1762,20010217,unknown,You Can Win
1763,20010217,unknown,Transparent Defects
1764,20010217,unknown,Straight Answers
1765,20010217,unknown,Counting Heads
1766,20010217,unknown,Census map is behind the times
1767,20010217,unknown,Sabrina Setlur ready to sing in India; says father
1768,20010218,unknown,Militancy and ceasefire cannot go together: PM
1769,20010218,unknown,A fleeting view of the grand maritime show
1770,20010218,unknown,Roshans; Bachchans steal the show
1771,20010218,unknown,Hrithik will play Hamlet; Hollywood style
1772,20010218,unknown,Promote FDI; tighten purse strings
1773,20010218,unknown,Global warming portends disaster for subcontinent
1774,20010218,unknown,Prof accuses Roman Catholic church for women neglect
1775,20010218,unknown,Filmfare Awards: Starry; starry nights!
1776,20010218,unknown,Govinda in Big B steps!
1777,20010218,unknown,Feroze Khan has kicked 'butts'!
1778,20010218,unknown,Rahul Roy has a Maharashtrian wife!
1779,20010218,unknown,Filmfare Awards: Starry; starry nights!
1780,20010218,unknown,Govinda in Big B steps!
1781,20010218,unknown,Feroze Khan has kicked 'butts'!
1782,20010218,unknown,Rahul Roy has a Maharashtrian wife!
1783,20010218,unknown,Rushdie abandons New York for 'uninspiring' London
1784,20010218,unknown,700 govt employees to retire this year
1785,20010218,unknown,90 Arrested for playing matka
1786,20010218,unknown,Motorists protest against helmet rule
1787,20010218,unknown,Indo-Pak ties on upswing; says Pak ex-minister
1788,20010218,unknown,Panther keeps forest officials on their toes
1789,20010218,unknown,Govt abused law to harm me; says ex-minister
1790,20010218,unknown,Tourism association frowns at canal officer's appointment
1791,20010219,unknown,Fresh gunfire in Srinagar as Army regrets earlier firings
1792,20010219,unknown,A divided govt leaves truce decision for another day
1793,20010219,unknown,Quake after-shock: More committees; more task forces
1794,20010219,unknown,Military's air prowess on 'Shockwave' show
1795,20010219,unknown,Poll plank or prudence? Mamata at a crossing
1796,20010219,unknown,Mrichchhakatika-II: Raja's 'saala' lords it over again
1797,20010219,unknown,Electric Blues
1798,20010219,unknown,An Interesting Cut
1799,20010219,unknown,High Stock Value
1800,20010219,unknown,Smiley's People
1801,20010219,unknown,Guns and Butter
1802,20010219,unknown,Human Evolution and The Ten Avatars
1803,20010219,unknown,Magic Years
1804,20010219,unknown,HAM to the Rescue
1805,20010219,unknown,Straight Answers
1806,20010219,unknown,Hanif Kureishi charms audiences at American univ
1807,20010219,unknown,Cancer fatigue: When they just don't have energy
1808,20010219,unknown,Global resolve to fight cancer
1809,20010219,unknown,Hrithik Roshan saves drowning director
1810,20010219,unknown,Madhuri Dixit: Pati badgered for KBC!
1811,20010219,unknown,Sushmita Sen: Engaged to Sanjay?
1812,20010219,unknown,Will 'Grahan' emerge from shadows at box-office?
1813,20010219,unknown,Patiala gharana and an ear for pop music
1814,20010219,unknown,Dharmendra: Terrorist attack!
1815,20010219,unknown,Lata Mangeshkar: Legendary aides!
1816,20010219,unknown,'Yeh Raaste Hain Pyaar Ke' makes new 'inroads'
1817,20010219,unknown,Faizal Khan: Down but Not out!
1818,20010219,unknown,Hrithik Roshan saves drowning director
1819,20010219,unknown,Sushmita Sen: Engaged to Sanjay?
1820,20010219,unknown,Dharmendra: Terrorist attack!
1821,20010221,unknown,PM calls all-party meet on ceasefire today
1822,20010221,unknown,Second will compounds Rajmata's legacy
1823,20010221,unknown,Veteran Communist leader Indrajit Gupta dead
1824,20010221,unknown,Worli-Bandra sea link enters crucial stage
1825,20010221,unknown,PIL challenging ACB bifurcation filed in HC
1826,20010221,unknown,MSEB pegs monthly Enron billing at Rs 500 crore from June
1827,20010221,unknown,'All-aware' Mumbaikars feel strongly about issues
1828,20010221,unknown,How can they impose their views on us?
1829,20010221,unknown,Tracking HIV in 10 minutes!
1830,20010221,unknown,Interative games are just child's play
1831,20010221,unknown,Microsoft faces new Antitrust probe over Corel deal
1832,20010221,unknown,Out-of-work wisdom; and a question of ethics
1833,20010221,unknown,Rana's success and its divine origins
1834,20010221,unknown,Napster stirs...ever so silently
1835,20010221,unknown,Child Power
1836,20010221,unknown,Bollywood bash for 'Gujarat'
1837,20010221,unknown,Salman Khan turns negative
1838,20010221,unknown,Abhishek Bachchan: Quite a prankster!
1839,20010221,unknown,Hrithik Roshan: Close-up and personal!
1840,20010221,unknown,Smita Patil's retrospective draws crowds at Moscow
1841,20010221,unknown,Bollywood bash for 'Gujarat'
1842,20010221,unknown,Hrithik Roshan: Close-up and personal!
1843,20010221,unknown,Abhishek Bachchan: Quite a prankster!
1844,20010221,unknown,Salman Khan turns negative
1845,20010221,unknown,Nepal Parliament adjourned again
1846,20010221,unknown,Fiji commander rules out commitment to court ruling
1847,20010221,unknown,Canadian PM to attend vigil for quake victims
1848,20010221,unknown,Rights watchdog asks UN to probe Taliban 'massacre'
1849,20010221,unknown,Probe ordered into remarks against S.African Indians
1850,20010221,unknown,Talks resumption cannot be conditional: Mubarak
1851,20010221,unknown,British racism and the tale of two Lords
1852,20010221,unknown,UB in talks with bottlers for picking up equity
1853,20010221,unknown,Maruti ropes in Hrithik to promote WagonR
1854,20010221,unknown,Super Cassettes to shut down mineral water business
1855,20010221,unknown,Reserve Bank cuts repo rate to 7.5%
1856,20010221,unknown,BPL focusses on the lower end; creates sub-brands
1857,20010221,unknown,Gujarat Positra Port project seeks Rs 3;200 cr FI loan
1858,20010221,unknown,Postal department plans new services to up revenue
1859,20010221,unknown,Foreign brands may cheer you as import curbs fade away
1860,20010221,unknown,No good news for movie buffs expected from Budget
1861,20010221,unknown,For Australian brothel; its business of pleasure
1862,20010222,unknown,Doves have their way; truce prevails
1863,20010222,unknown,Amanullah; 87 others to apply for Indian visas
1864,20010222,unknown,It's back to the days of protest
1865,20010222,unknown,India Caucus to work for lifting of sanctions
1866,20010222,unknown,Govt makes cut-rate sale of BALCO
1867,20010222,unknown,Mahima Chaudhary: Angry damsel!
1868,20010222,unknown,Sunjay Dutt: Fringe benefits!
1869,20010222,unknown,Rahul: Cutefully yours!
1870,20010222,unknown,Panini Raj Kumar: A new kinda stepping stone!
1871,20010222,unknown,Grammy nominee Scott overwhelmed
1872,20010222,unknown,EVM controversy: EC unfazed by Jaya's petition
1873,20010222,unknown,Bloated bureaucracy empties coffers; stops development
1874,20010222,unknown,Census: Tough task for enumerators
1875,20010222,unknown,Taxation or no? Goa public are anxious
1876,20010222,unknown,There's no use shying away from shyness
1877,20010222,unknown,Govt decision on wards stayed
1878,20010222,unknown,Rs 3 crore for road construction
1879,20010222,unknown,Festival of plays from Feb 26
1880,20010222,unknown,Russia to continue N-fuel supply despite US protest
1881,20010222,unknown,A Billion Mutinies
1882,20010222,unknown,Guarding the Oceans
1883,20010222,unknown,Poem Ahoy
1884,20010222,unknown,The Golden Genome
1885,20010222,unknown,Nirvana is Within Reach of Everyone
1886,20010222,unknown,Double Trouble
1887,20010222,unknown,Sense of Humour
1888,20010222,unknown,Indecent Exposure
1889,20010222,unknown,Straight Answers
1890,20010222,unknown,Active Peace
1891,20010222,unknown,Fiji PMO denies disinterest in charges against Speight
1892,20010222,unknown,Canada to let in 235;000 immigrants in 2002
1893,20010222,unknown,Asia Foundation favors US role in Kashmir dispute
1894,20010222,unknown,US IP worth $300 mn stolen in India: Report
1895,20010222,unknown,Mother Teresa monument near Seattle
1896,20010222,unknown,FBI agent's arrest ends major security breach
1897,20010222,unknown,S.African Indian heads Uruguay mission
1898,20010222,unknown,Russia to continue N-fuel supply despite US protest
1899,20010222,unknown,I-T department looking to widen scope of PAN
1900,20010222,unknown,US IP worth $300 mn stolen in India: Report
1901,20010222,unknown,Will the stock market get a shot in arm?
1902,20010222,unknown,Reebok eyes fitness segment
1903,20010222,unknown,Govt makes cut-rate sale of BALCO
1904,20010222,unknown,Cellphone market abuzz with rising subscriber base
1905,20010222,unknown,Aksh to invest Rs90cr for hiking capacity
1906,20010222,unknown,Bharti Mobile served Rs 477 cr demand notice
1907,20010222,unknown,Ranbaxy; Dade to convert pact into JV
1908,20010223,unknown,Truce to be tried out for 3 more months
1909,20010223,unknown,Enough elbow room for all sides
1910,20010223,unknown,Oppn wants govt to come clean on BALCO deal
1911,20010223,unknown,I-T; UTI spat over interest tax
1912,20010223,unknown,Only 26% Indians are poor; claims plan panel
1913,20010223,unknown,Bengal doctors struggle with killer disease
1914,20010223,unknown,NRI-headed company develops low-cost AIDS test
1915,20010223,unknown,Shed excess weight in a week
1916,20010223,unknown,Mamooty best actor in the Asianet Lux Film Awards
1917,20010223,unknown,Hrithik to enthral capital denizens Friday night
1918,20010223,unknown,Lata Mangeshkar to sing at quake fund raiser
1919,20010223,unknown,Ashutosh Rana: Shiva-ling-ling-ling!
1920,20010223,unknown,Flawed Diplomacy
1921,20010223,unknown,Govt wakes up to keep House promises
1922,20010223,unknown,Bihar headed for a flat budget
1923,20010223,unknown,Cong erred by joining RJD govt; says Rama Pilot
1924,20010223,unknown,Chaitudih mine closed after gas leak
1925,20010223,unknown,Munna's men continue seige on Muzaffarpur hospital
1926,20010223,unknown,Bandh hits life in Bhagalpur
1927,20010223,unknown,Whose mother tongue is Hindi; anyway?
1928,20010223,unknown,Awaiting promotion; top I-T official shifted
1929,20010223,unknown,No arms licence to be issued till panchayat poll
1930,20010223,unknown,Medical Re-registration Bill on the cards
1931,20010223,unknown,Traders feel unsafe at Muzaffarpur
1932,20010223,unknown,12 injured as villagers clash with police
1933,20010223,unknown,State distributors' body stops lifting HLL products
1934,20010223,unknown,Trust to 'give up' leprosy home
1935,20010223,unknown,All that dough
1936,20010223,unknown,Mamooty best actor in the Asianet Lux Film Awards
1937,20010223,unknown,Hrithik to enthral capital denizens Friday night
1938,20010223,unknown,Lata Mangeshkar to sing at quake fund raiser
1939,20010223,unknown,Ashutosh Rana: Shiva-ling-ling-ling!
1940,20010223,unknown,Anupama Verma: The grahan has been wiped off
1941,20010223,unknown,Govinda: All dressed up and nowhere to go?
1942,20010223,unknown,Sunil Shetty: Kyunki saas hee saas hai!
1943,20010223,unknown,Sri Hari's big talks
1944,20010223,unknown,Karnataka officials take to the silver screen
1945,20010223,unknown,Berlin award for Kerala film director praised
1946,20010223,unknown,Cease Fire
1947,20010223,unknown,Transparency Please
1948,20010223,unknown,Age of Art
1949,20010223,unknown,Hard Times; Soft Budget
1950,20010223,unknown,The Many Benefits Of Daily Prayer
1951,20010223,unknown,Coat of Arms
1952,20010223,unknown,Beautiful People
1953,20010223,unknown,Low Rates; High Returns
1954,20010223,unknown,Straight Answers
1955,20010223,unknown,Judicial probe ordered into attack on Gowda's wife
1956,20010223,unknown,Family feud suspected behind acid attack
1957,20010223,unknown,Leave it to God: Deve Gowda
1958,20010223,unknown,Bandh total; Cong worker attacked
1959,20010223,unknown,Alert Sub-Inspector turns saviour
1960,20010223,unknown,Chennamma's surgery today
1961,20010223,unknown,SPG looking into 'lapse'
1962,20010223,unknown,Wildlife as work and passion
1963,20010223,unknown,Govt derives formula to improve SSLC results
1964,20010223,unknown,Bill for unorganised sector on the anvil
1965,20010223,unknown,Maharashtra minister injured in accident
1966,20010223,unknown,Students ask CM to revoke decision on grants cut
1967,20010223,unknown,The salsa was superb; and who's your caterer?
1968,20010223,unknown,Fish out of fresh water
1969,20010223,unknown,The healing touch
1970,20010223,unknown,Let's switch to LPG. It's safe
1971,20010223,unknown,Their bamboo music is hard to beat
1972,20010223,unknown,Just ignore the fine print
1973,20010223,unknown,Vrishabhavathinagar: A village woken up
1974,20010223,unknown,Drug abuse cases on a rise in Bangalore
1975,20010223,entertainment.english.hollywood,Bootmen
1976,20010224,unknown,Survey signals bold steps in Budget
1977,20010224,unknown,Govt may beat a retreat on BALCO
1978,20010224,unknown,Boost for BJP; allies; shock for Congress
1979,20010224,unknown,Six policemen killed in ambush
1980,20010224,unknown,Cricket board clips Bindra's wings by banning him
1981,20010224,unknown,Sushma clamps down on Close-Up ad
1982,20010224,unknown,Karunanidhi rules out tie-up with TMC
1983,20010224,unknown,No official order on prize for tip-offs on Veerappan
1984,20010224,unknown,Residents step up stir for road
1985,20010224,unknown,Big-time dealers set a trap for drug peddlers
1986,20010224,unknown,Sparks fly after Cong leaders dropped from GPC
1987,20010224,unknown,Goa govt bails out coconut farmers
1988,20010224,unknown,Goa in debt by Rs 1;414 cr
1989,20010224,unknown,South Korea woos Goa with big plans
1990,20010224,unknown,Decision is shocking: Sequeira
1991,20010224,unknown,Kerala gets a dream budget that won't work
1992,20010224,unknown,Kerala'll get tipsy if Left returns
1993,20010224,unknown,Darkness in Karnataka as power grid trips
1994,20010224,unknown,Govt withdraws order on cut in college grants
1995,20010224,unknown,Govt revokes suspension of officers
1996,20010224,unknown,Chennamma operated; under intensive care
1997,20010224,unknown,Lokesh confesses; but has no regrets
1998,20010224,unknown,Attack: Nature of inquiry yet to be decided
1999,20010224,unknown,When you nail down MC Hammer
2000,20010224,unknown,Virtual bridge from B'lore to Hollywood is heavy with traffic
2001,20010224,unknown,5-yr-old fights for life after drinking arrack
2002,20010224,unknown,BATF will soldier on for better civic life
2003,20010224,unknown,Is Bangalore moving forward?
2004,20010224,unknown,A different ball game for Nagma now
2005,20010224,unknown,Is Brindavan Gardens losing its charm?
2006,20010224,unknown,Something to smile about
2007,20010224,unknown,The city on a school wall
2008,20010224,unknown,Sudden hot spell won't last long
2009,20010224,unknown,ELRTS plays spoilsport; delays flyover work
2010,20010224,unknown,Industrial unit raided for meter tampering
2011,20010224,unknown,Stress on free; compulsory education for children
2012,20010224,unknown,They help women overcome barrier; achieve success
2013,20010224,unknown,HC admits petition seeking tank's maintainance
2014,20010224,unknown,Lok Ayukta probe into irregularities
2015,20010224,unknown,Kannada film bags award
2016,20010224,unknown,Adventure unlimited at Palace Grounds
2017,20010224,unknown,Yellow line violators make traffic cops see red
2018,20010224,unknown,Animal sacrifice: Maneka wants minister punished
2019,20010224,unknown,'US shouldn't take its advantage for granted'
2020,20010224,unknown,KPTC disrupts power supply for CM's sake
2021,20010224,unknown,Lift block on road; orders minister
2022,20010224,unknown,Centre misusing quake issue to impose tax
2023,20010224,unknown,Rs 995 cr WB aid for developing tanks
2024,20010224,unknown,CM hitch-hikes on bullock-cart
2025,20010224,unknown,'Minister suppressing evacuees' voice'
2026,20010224,unknown,Coop society turns 75
2027,20010224,unknown,Janasabha: The catalyst between people; departments
2028,20010224,unknown,Panel to study pesticide ill-effects
2029,20010224,unknown,JVSL lends sympathetic ear to villagers' woes
2030,20010224,unknown,JD(S) postpones protest convention
2031,20010224,unknown,Secrets of the Sect
2032,20010225,unknown,Pink slips herald nightmare for Indian nerds in US
2033,20010225,unknown,'Swadeshi' Vajpayee role model of modern hunks
2034,20010225,unknown,Govt fails to assist quake-hit industries
2035,20010225,unknown,Surat police arrests eight for killings; robberies
2036,20010225,unknown,Western railway announce special train to clear rush
2037,20010225,unknown,Woman stakes claim to world's smallest Gita
2038,20010225,unknown,Mysterious gas may be hydrogen sulphide
2039,20010225,unknown,Law faculty agitation turns violent
2040,20010225,unknown,Padra investors duped of Rs 1.5 lakh
2041,20010225,unknown,SAIL quarters are on sale
2042,20010225,unknown,Alliances fail to influence voting in by polls
2043,20010225,unknown,Confused Tibetan Buddhists await Karmapa's visit
2044,20010225,unknown,20 Naxalites held in Garhwa in two months
2045,20010225,unknown,Salaries not paid to Sanskrit teachers; staff
2046,20010225,unknown,Cosmopolitanism rooted in community discussed
2047,20010225,unknown,Hooper back to reclaim place in Windies team
2048,20010225,unknown,Govt double-talk gives Veerappan the edge
2049,20010225,unknown,STF nabs close aide of Veerappan
2050,20010225,unknown,Thief throws baby into well
2051,20010225,unknown,17.5 crore phone connections in India by 2010
2052,20010225,unknown,NABARD to loan Rs 1600 cr to Haryana
2053,20010225,unknown,Jacob pays surprise visits to schools; hospital
2054,20010225,unknown,Bibi files fresh application
2055,20010225,unknown,Fuel cell engines to replace petrol and diesel ones
2056,20010225,unknown,The emperor of cricket is dead
2057,20010225,unknown,A Hero for Our Time
2058,20010226,unknown,Civilian deaths swelling J&K militant ranks
2059,20010226,unknown,Sonia harps on a new mantra: Farmanomics
2060,20010226,unknown,Tuition for Sonia
2061,20010226,unknown,IT Crash Course
2062,20010226,unknown,Committee Calamity
2063,20010226,unknown,Coffee or Pot?
2064,20010226,unknown,Retirement Investing
2065,20010226,unknown,Why We Listen to Lies; not to Truth
2066,20010226,unknown,Speed of Life
2067,20010226,unknown,True Love
2068,20010226,unknown,Drugs for Development
2069,20010226,unknown,Straight Answers
2070,20010226,unknown,Roshan Seth throws light on his celluloid career
2071,20010226,unknown,Salman Khan turns negative
2072,20010226,unknown,Anupama Verma: 'Grahan' wiped off!
2073,20010226,unknown,4 held for murder of Malad housewife
2074,20010226,unknown,Accused in gold watch scam given clean chit
2075,20010226,unknown,Chembur-Trombay residents oppose LNG plant
2076,20010226,unknown,Govt figures on AIDS doctored; says Countess
2077,20010226,unknown,Three in race to pick up equity in Leela group
2078,20010226,unknown,HC will hear UTI petition today
2079,20010226,unknown,Why the failure to privatise Balco is harmful?
2080,20010226,unknown,NTPC may curtail supply to BSEB
2081,20010226,unknown,Health dept grapples with irregular appointments
2082,20010226,unknown,Paddy sale; not panchayat poll; bothers them
2083,20010226,unknown,Aap mobile hain; hum confined hain: Laloo to scholars
2084,20010226,unknown,Samata uses by-election result to flay Paswan
2085,20010226,unknown,Govt may privatise closed sugar mills
2086,20010226,unknown,Move to evict people from embankments opposed
2087,20010226,unknown,Breeding of leopard cat in captivity in zoo
2088,20010226,unknown,BIT students on hunger strike
2089,20010226,unknown,Spurt in crime worries Bhagalpur residents
2090,20010226,unknown,Bihar Red Cross to adopt village
2091,20010226,unknown,PU staff stage dharna seeking central pay scales
2092,20010226,unknown,CISF sub-inspector shot dead
2093,20010226,unknown,BRABU Senate okays Rs 195-crore budget
2094,20010226,unknown,AIPWA to take up cudgels on behalf of women
2095,20010226,unknown,Australian plane remains stranded
2096,20010226,unknown,Retirement Investing
2097,20010227,unknown,Mamata chugs along beaten track; spares passengers
2098,20010227,unknown,The Don misses another century
2099,20010227,unknown,Court says Bangla migrants a security threat
2100,20010227,unknown,Delhi; Chennai worst cities to live in: UK survey
2101,20010227,unknown,MPs protest Mamata's frugality with trains
2102,20010227,unknown,Mamata ignores experts at Railways' peril
2103,20010227,unknown,Mamata gives few sops to Bengal
2104,20010227,unknown,Trinamul to make Mamata's gifts a poll plank
2105,20010227,unknown,Reform II gets a jolt with populist Rail budget
2106,20010227,unknown,Pvt role sought in Railways info system
2107,20010227,unknown,Rail budget regressive: Congress
2108,20010227,unknown,Didi has her way
2109,20010227,unknown,Train to Nowhere
2110,20010227,unknown,Phoenix Rising
2111,20010227,unknown,Don of An Era
2112,20010227,unknown,Government by 'Schemes'
2113,20010227,unknown,Get Rid of Desires; Realise Your Self
2114,20010227,unknown,Sense and Census
2115,20010227,unknown,The Planet's Plight
2116,20010227,unknown,Language Problems
2117,20010227,unknown,Tiruvarur set for cyber sufficiency
2118,20010227,unknown,A rare surgery; yet a success story
2119,20010227,unknown,Budget for Growth
2120,20010227,unknown,Straight Answers
2121,20010227,unknown,Cong set to challenge BJP govt in Goa
2122,20010227,unknown,IT to propel tourism to greater heights
2123,20010227,unknown,Implement policy to keep beaches tidy; govt told
2124,20010227,unknown,Panaji DD doors shut on Lata Mangeshkar
2125,20010228,unknown,A common man's Budget
2126,20010228,unknown,Taliban decree may punch gaps in Indian history
2127,20010228,unknown,Blackwill likely US envoy to India
2128,20010228,unknown,Command Performance
2129,20010228,unknown,Toxic Transfer
2130,20010228,unknown,Damned to Fame
2131,20010228,unknown,Economic Slowdown
2132,20010228,unknown,Lent: A Time for Prayer & Good Works
2133,20010228,unknown,Bond with the Bard
2134,20010228,unknown,Human Initiative
2135,20010228,unknown,Straight Answers
2136,20010228,unknown,Cops lied; I was arrested from a house; says Maran
2137,20010228,unknown,Hesistant TMC may join AIADMK alliance
2138,20010228,unknown,PIL against poor transport service in Nilgiris
2139,20010228,unknown,Politicians get ready for party-hopping
2140,20010228,unknown,Spitting in a public place may cost you Rs 5;000
2141,20010228,unknown,Police fail to nab gang of thieves
2142,20010228,unknown,Stolen vehicles recovered; two held
2143,20010228,unknown,New traffic system in Margao hailed
2144,20010228,unknown,In Kannur; 180 killed in five years of Left rule
2145,20010228,unknown,Veerappan may be back in TN or Karnataka
2146,20010228,unknown,A common man's Budget
2147,20010228,unknown,Ayes & Nays
2148,20010228,unknown,Uncommon budgets for the common man
2149,20010228,unknown,Don't use your mobile; traffic cops are watching
2150,20010228,unknown,Govt staff may face retirement before 58
2151,20010228,unknown,18 more ill with gastroenteritis
2152,20010228,unknown,Costs increase pain for kidney patients
2153,20010228,unknown,AIDS wracks her body; but the spirit lives on
2154,20010228,unknown,150 huts gutted in slum fire
2155,20010228,unknown,Patel had tears in his eyes: Krishna
2156,20010228,unknown,A common man's Budget
2157,20010228,unknown,Taliban decree may punch gaps in Indian history
2158,20010228,unknown,Blackwill likely US envoy to India
2159,20010228,unknown,Universal View
2160,20010228,unknown,Command Performance
2161,20010228,unknown,Toxic Transfer
2162,20010228,unknown,Damned to Fame
2163,20010228,unknown,Economic Slowdown
2164,20010228,unknown,Lent: A Time for Prayer & Good Works
2165,20010228,unknown,Bond with the Bard
2166,20010228,unknown,Human Initiative
2167,20010228,unknown,Simpler; Shorter; Smarter
2168,20010228,unknown,Straight Answers
2169,20010228,unknown,Cops lied; I was arrested from a house; says Maran
2170,20010228,unknown,Hesistant TMC may join AIADMK alliance
2171,20010228,unknown,PIL against poor transport service in Nilgiris
2172,20010228,unknown,Politicians get ready for party-hopping
2173,20010228,unknown,Spitting in a public place may cost you Rs 5;000
2174,20010228,unknown,Police fail to nab gang of thieves
2175,20010228,unknown,Stolen vehicles recovered; two held
2176,20010228,unknown,New traffic system in Margao hailed
2177,20010228,unknown,Bishop's prayer for train goes unanswered
2178,20010301,unknown,Savvy Sinha cuts a new deal
2179,20010301,unknown,Markets cheer reform measures
2180,20010301,unknown,Proposals major boost for Corporates
2181,20010301,unknown,Drastic changes proposed in labour laws
2182,20010301,unknown,Defence allocations go up by 13.8%
2183,20010301,unknown,Valuable Lessons
2184,20010301,unknown,Big Pluses; Small Minuses
2185,20010301,unknown,Bearded Thoughts
2186,20010301,unknown,Command Performance
2187,20010301,unknown,Involve the Islamists
2188,20010301,unknown,The Kingdom of God Is Within Each of Us
2189,20010301,unknown,Corn & Porn
2190,20010301,unknown,The Arthashastra
2191,20010301,unknown,A Cocktail that Cures
2192,20010301,unknown,Straight Answers
2193,20010301,unknown,Police in a tizzy over burglaries
2194,20010301,unknown,Positive Budget; says CM
2195,20010301,unknown,Edegra is here to enhance sexual activity
2196,20010301,unknown,HC order to CBI in paedophile case
2197,20010301,unknown,Goan artisans to get more prominence
2198,20010301,unknown,Faleiro seeks Parrikar's resignation
2199,20010301,unknown,Planning board to finalise approach to 10th Plan
2200,20010301,unknown,Pak to start serial production of short-range missiles
2201,20010301,unknown,Pak to start serial production of short-range missiles
2202,20010301,unknown,US asks Taliban to halt desecration of statues
2203,20010301,unknown,Sharifs lose Lahore family house
