,publish_date,headline_category,headline_text
2672,20010325,unknown,Firmly on ground
2673,20010325,unknown,One two ka four
2674,20010325,unknown,Same time; same place; next week
2675,20010325,unknown,Midnight's child
2676,20010325,unknown,What; me worry?
2677,20010325,unknown,The happiness of a long-distance runner
2678,20010325,unknown,Delhi's new power elite?
2679,20010325,unknown,Cerebral success
2680,20010325,unknown,An ode to Apu
2681,20010325,unknown,The censors seem to have lost their scissors
2682,20010325,unknown,Kutch on the rolls
2683,20010325,unknown,Radio diva
2684,20010325,unknown,Angst on screen
2685,20010325,unknown,If India Can; Why Can't We?
2686,20010326,unknown,NDA partners close ranks; to take on Congress
2687,20010326,unknown,Tehelka jolts BJP's economic resolution
2688,20010326,unknown,Advani Rath Yatra funded by Dawood: Adm Bhagwat
2689,20010326,unknown,Aussies go down under; again
2690,20010326,unknown,Have fun in Afghanistan? Enjoy the weather...
2691,20010326,unknown,Should 'Barf' be shelved?
2692,20010326,unknown,Ek Rishta slated to release in June
2693,20010326,unknown,Govinda: Back with a vengeance and how!
2694,20010326,unknown,Kabhi true kabhi false!
2695,20010326,unknown,Tobacco convention to make public health a priority
2696,20010326,unknown,Should 'Barf' be shelved?
2697,20010326,unknown,Ek Rishta slated to release in June
2698,20010326,unknown,Govinda: Back with a vengeance and how!
2699,20010326,unknown,International child music festival hold 8th edition
2700,20010326,unknown,Enemy Within
2701,20010326,unknown,Question Time The appointment of George Verghese
2702,20010326,unknown,Life's Elixir
2703,20010326,unknown,Broccoli Brouhaha
2704,20010326,unknown,Deals Within Deals
2705,20010326,unknown,Management Gurus Don't Know This
2706,20010326,unknown,Not by Bread Alone
2707,20010326,unknown,Lasting Joy
2708,20010326,unknown,No Child's Play
2709,20010326,unknown,Straight Answers
2710,20010326,unknown,MUL finance; used car deals under 'True Value' brand
2711,20010326,unknown,Vehicle insurance policy gets away with loopholes
2712,20010326,unknown,Inter-ministerial tussle holds up oil cos' ATF dues
2713,20010326,unknown,Panacea Biotech to tie up with foreign firm for genome research
2714,20010326,unknown,Power majors vie for DVB's distribution assets
2715,20010326,unknown,Gasfuse kicks off Indian operations
2716,20010326,unknown,Hospitality sector facing manpower crunch: Study
2717,20010326,unknown,Kwality plans more cool flavours
2718,20010326,unknown,UTI launches Unit scheme for women
2719,20010326,unknown,JK Tyres plans to outsource growth
2720,20010326,unknown,Cellphone firms aim at the gaming market
2721,20010326,unknown,Japan's megabank may herald another crisis
2722,20010326,unknown,Order on helmets kept under abeyance
2723,20010326,unknown,Programmes on energy conservation mooted
2724,20010326,unknown,Rescuing; rearing dogs is their pet job
2725,20010326,unknown,More aggro marks the 'I Want' generation
2726,20010326,unknown,Pagers help to fix faulty phones in quick time
2727,20010326,unknown,How to help an accident victim
2728,20010326,unknown,Mysore hotel owners vow not to employ children
2729,20010326,unknown,Policy to check wrong doings in agro sector on cards
2730,20010326,unknown,She strains to leave; but hospital restrains
2731,20010326,unknown,Apathy delivers deadly blow to this policeman
2732,20010326,unknown,Pak air force to test missiles; rockets today
2733,20010326,unknown,Police officers summoned for harrasing backward class person
2734,20010326,unknown,Special adalat released habitual offender:Officials
2735,20010326,unknown,Suspect in murder bid held
2736,20010327,unknown,Midnight meet leads to new alliance in West Bengal
2737,20010327,unknown,Four CRPF men killed in Lashkar attack
2738,20010327,unknown,Sharjah still a mirage for Indian cricketers
2739,20010327,unknown,Constitution panel report smacks of plagiarism
2740,20010327,unknown,Pernicious Gambit
2741,20010327,unknown,Box-Office Castaways
2742,20010327,unknown,Twiddledee; Twiddledum
2743,20010327,unknown,Satanic and Worse
2744,20010327,unknown,In Top Gear
2745,20010327,unknown,Jihad is War Against One's Inner Demons
2746,20010327,unknown,Cards of Memory
2747,20010327,unknown,Close Your Eyes
2748,20010327,unknown,Grid for Power
2749,20010327,unknown,Straight Answers
2750,20010327,unknown,Goa to allow more private schools
2751,20010327,unknown,Faleiro criticises BJP govt's functioning
2752,20010327,unknown,Malaria cases on the rise
2753,20010327,unknown,Counting of votes for Panaji council today
2754,20010327,unknown,Gudi Padwa celebrated
2755,20010327,unknown,Poll panel to enforce Cable Act strictly
2756,20010327,unknown,Medha hits out at corrupt politicians
2757,20010327,unknown,Akshay Kumar-Twinkle: Siamese twins?
2758,20010327,unknown,Mithun goes global!
2759,20010327,unknown,Shekar Suman meets Laloo!
2760,20010327,unknown,Sleazy films storm Bollywood!
2761,20010327,unknown,Stars show off old-fashioned fashions
2762,20010327,unknown,Akshay Kumar-Twinkle: Siamese twins?
2763,20010327,unknown,Shekar Suman meets Laloo!
2764,20010327,unknown,No immediate review of rail fare: Nitish
2765,20010327,unknown,LS informed about warrants against Sharad
2766,20010327,unknown,Mystery shrouds Gaya shootout; DSP's injury
2767,20010327,unknown,Mahavir Prasad holds talks with Cong leaders
2768,20010327,unknown,Din over police raid on Samata activist's house
2769,20010327,unknown,Don't travel without tickets; says Nitish
2770,20010327,unknown,Now DVC threatens to cut power supply to Jharkhand
2771,20010327,unknown,Mining engrs' convention held in Ranchi
2772,20010328,unknown,Bishop's prayer for train goes unanswered
2773,20010328,unknown,India; Austrlia set for a do-or-die match in Pune
2774,20010328,unknown,Bookies see booming business
2775,20010328,unknown,100 million in grip of drought; worse yet to come
2776,20010328,unknown,Politics mars National Film Awards
2777,20010328,unknown,Leak of Chokila's letter upsets govt
2778,20010328,unknown,Parivar now sees the enemy in Subhash Chandra
2779,20010328,unknown,Green Signal
2780,20010328,unknown,Riot after Riot
2781,20010328,unknown,Age of Controversy
2782,20010328,unknown,Keep the Faith
2783,20010328,unknown,Vidura's Wisdom Had No Serious Takers
2784,20010328,unknown,On Tiger Trail
2785,20010328,unknown,That's God
2786,20010328,unknown,Between Dishnet & Deep Sea
2787,20010328,unknown,Straight Answers
2788,20010328,unknown,PMK distances itself from LTTE
2789,20010328,unknown,Best film and more for Malayalam at National Awards
2790,20010328,unknown,He's a rare blend of respect and toughness
2791,20010328,unknown,Dacoities will end; says CM; Cong walks out
2792,20010328,unknown,Cong; BJP share spoils in municipal polls
2793,20010328,unknown,French trio charm Goan audience
2794,20010328,unknown,A campaign in aid of TB patients
2795,20010328,unknown,CNR Rao thrilled over award
2796,20010328,unknown,Now there's a chatterbox that sings too
2797,20010328,unknown,Schools make a fast buck; but none complaining
2798,20010328,unknown,Lights; action and give him a camera
2799,20010328,unknown,BCC cooked the books; says report
2800,20010328,unknown,This fighter finally met his match
2801,20010328,unknown,Beer provision stores will keep women away
2802,20010328,unknown,Karnataka has 5.2 crore people
2803,20010328,unknown,Parikramashow their mettle
2804,20010328,unknown,Bribes are a big barrier for investors
2805,20010328,unknown,Harvesting rainwater is crucial
2806,20010328,unknown,Water worries and dug up roads
2807,20010328,unknown,New school timings upset parents
2808,20010328,unknown,This community centre is a death trap
2809,20010328,unknown,Tehelka on TV leaves them shocked and angry
2810,20010328,unknown,IT savvy state to get computerised ration card
2811,20010328,unknown,Mixed reaction to hike on gutka tax
2812,20010328,unknown,Revival of subject panels futile: Oppn
2813,20010328,unknown,Tax commission unhappy with VAT status
2814,20010328,unknown,40 heart valve change surgeries done
2815,20010328,unknown,Diabetes may add to your heart trouble
2816,20010328,entertainment.english.hollywood,Cast Away
2817,20010329,unknown,GSLV engine trouble sours India's space plans
2818,20010329,unknown,Lashkar chief gunned down in encounter
2819,20010329,unknown,BJP dumps Mamata; to go it alone in Bengal
2820,20010329,unknown,CBI cracks down on Sonia's aide; seizes accounts
2821,20010329,unknown,No hope for the AIDS outcast
2822,20010329,unknown,Electoral Reform
2823,20010329,unknown,Anil Kapoor: They've heard his Pukar!
2824,20010329,unknown,Sonali: Getting older and wiser!
2825,20010329,unknown,Govinda: No pens please! i'm superstitious!
2826,20010329,unknown,Jury's Out
2827,20010329,unknown,Bullet Democracy
2828,20010329,unknown,Pati; Patni aur Woh
2829,20010329,unknown,Bourses Off Course
2830,20010329,unknown,Vipassana: Journey Into the True Self
2831,20010329,unknown,Boon of a Town
2832,20010329,unknown,Drawing the Line
2833,20010329,unknown,Guru Cool
2834,20010329,unknown,Straight Answers
2835,20010329,unknown,Race politics hots up in UK
2836,20010329,unknown,Race politics hots up in UK
2837,20010329,unknown,All is not hunky-dory with MDMK; says Karunanidhi
2838,20010329,unknown,JD(S) to keep Cong; BJP at bay: Deve Gowda
2839,20010329,unknown,Veerappan legend drowns Bannari temple's colourful past
2840,20010329,unknown,Priest enters poll fray
2841,20010329,unknown,Luxury train planned on Konkan route
2842,20010329,unknown,Mundkar evacuees issue embroiled in legal tangle
2843,20010329,unknown,Panel opposes Ground Water Bill
2844,20010329,unknown,Govt can now terminate assignments of housing board chiefs
2845,20010329,unknown,Casino vessel seized
2846,20010329,unknown,Role of language in preserving culture stressed
2847,20010329,unknown,Govt not aware of licence issue
2848,20010329,unknown,Grade A status for rice to continue in Rabi: CM
2849,20010329,unknown,TDP MLA urges Govt to work for eunuchs welfare
2850,20010329,unknown,3 adjournment motions disallowed
2851,20010329,unknown,Sessions judge to probe lock-up death
2852,20010329,unknown,7;500 offences in city still not solved
2853,20010329,unknown,MSEB team dispels darkness in Bhachau
2854,20010329,unknown,The sound of Alabina
2855,20010329,unknown,Twinkle toes
2856,20010329,unknown,Power brothers
2857,20010329,unknown,Alliance with Trinamul off; declares BJP
2858,20010329,unknown,BJP defends film awards
2859,20010329,unknown,Bangaru a Tehelka scapegoat: Mayawati
2860,20010329,unknown,Venkaiah senses conspiracy to oust NDA govt
2861,20010329,unknown,Bank accounts of Vincent George; kin frozen
2862,20010330,unknown,CM vows Rs 5 cr for ground water project report
2863,20010330,unknown,Code of ethics for BJP rank-and-file
2864,20010330,unknown,Sonia; Mamata may shake hands soon
2865,20010330,unknown,Ghosh says no to award; Sushma denies charges
2866,20010330,unknown,Govt still myopic on drought control
2867,20010330,unknown,Any Answers?
2868,20010330,unknown,Regulation Scam
2869,20010330,unknown,Space Selling
2870,20010330,unknown,Bachelors & Spinsters
2871,20010330,unknown,Counter Wailing Duty
2872,20010330,unknown,Religion is Path to Realisation of God
2873,20010330,unknown,Can and Cannot
2874,20010330,unknown,For Whom?
2875,20010330,unknown,Old PCs Made New
2876,20010330,unknown,Straight Answers
2877,20010330,unknown,Raveena Tandon: 'Sorry' says Pradeep Kishan!
2878,20010330,unknown,Why Indian films flop at the Oscars: Benegal
2879,20010330,unknown,Karan Nath: Wishing star
2880,20010330,unknown,Rajat Mukherjee: What are you talking about?
2881,20010330,unknown,Armaan Kohli: Re-naming ceremony!
2882,20010330,unknown,Body; mind and soul in God's own country
2883,20010330,unknown,A holiday that heals
2884,20010330,unknown,Govt under attack for low arecanut prices
2885,20010330,unknown,Chairs; tables go missing from Assembly
2886,20010330,unknown,Minister agrees to survey on tanks
2887,20010330,unknown,Two hotel employees get lifer for murder
2888,20010330,unknown,Case against man who beat 'thief' to death
2889,20010330,unknown,Oath is hard to toss
2890,20010330,unknown,Vajda ends Marach's dream run
2891,20010330,unknown,Can Chidambaram win the battle against Jaya?
2892,20010330,unknown,Tiger skins seized at Tirupur rail station
2893,20010330,unknown,State has 6.21 crore people now
2894,20010330,unknown,Reforms will go on despite Tehelka: Mahajan
2895,20010330,unknown,Row over zonal academies
2896,20010330,unknown,Ranji semi-finals postponed
2897,20010330,unknown,JNST to send U-25 cricket team to UAE
2898,20010330,unknown,Indian football's glory days
2899,20010330,unknown,Baichung confident of good showing
2900,20010330,unknown,India play England in World Cup Polo opener
2901,20010330,unknown,4-day rally training session in Panaji
2902,20010330,unknown,Row over zonal academies
2903,20010330,unknown,India play England in World Cup Polo opener
2904,20010330,unknown,Madhavpura Bank chief yet to be booked
2905,20010330,unknown,...RBI warnings were ignored
2906,20010330,unknown,Shyam Aces gets LoI for satellite telephony
2907,20010330,unknown,Cigarettes makers wary of Chinese brands
2908,20010401,unknown,Indians attacked by 'monkey man'
2909,20010404,unknown,New US visa promises family reunions
2910,20010404,unknown,Apex court in unreal world; says Dikshit
2911,20010404,unknown,Clinton arrives in Delhi on Yatra-II
2912,20010404,unknown,Naidu cold-shouldered by NDA on home turf
2913,20010404,unknown,Aussies bounce back to level series
2914,20010404,unknown,Kerala pendulum swings UDF's way
2915,20010404,unknown,Laagan countdown!
2916,20010404,unknown,'Love you Hamesha' runs into rough weather!
2917,20010404,unknown,Hey; I'm not Sheikh Chilli!
2918,20010404,unknown,Caught in a purple haze
2919,20010404,unknown,Mohan Lal to shoot for company!
2920,20010404,unknown,State as Rioter
2921,20010404,unknown,Buyer Beware
2922,20010404,unknown,Red Alert for Bengal
2923,20010404,unknown,Hitting the Wicket
2924,20010404,unknown,Rev up Rural India
2925,20010404,unknown,Mahavira's Message Of Ahimsa & Anekant
2926,20010404,unknown,The Middle Path
2927,20010404,unknown,Jain Scriptures
2928,20010404,unknown,Straight Answers
2929,20010404,unknown,Foot-and-mouth courtesy Sophie
2930,20010404,unknown,V Visa power: Go get it
2931,20010404,unknown,US to streamline family-based visa rules
2932,20010404,unknown,HC to dental course students' rescue
2933,20010404,unknown,Stage set for meet on tribal problems
2934,20010404,unknown,Two women held in baby girls' sale
2935,20010404,unknown,Leaders react cautiously on code of ethics
2936,20010404,unknown,Hey; I'm not Sheikh Chilli!
2937,20010404,unknown,An audio kit will act as your tourist guide now
2938,20010404,unknown,Cops shoot off missive to govt on reservation
2939,20010404,unknown,Ragging victim to approach Human Rights panel
2940,20010404,unknown,Nothing above corruption
2941,20010404,unknown,With mirth; from Planet Earth
2942,20010404,unknown,This cruel congenital disorder hits the poor
2943,20010404,unknown,Caught in a purple haze
2944,20010404,unknown,Superintending engineer's house raided
2945,20010404,unknown,Buyer Beware
2946,20010405,unknown,GTB; UTI Bank end mega-merger dreams
2947,20010405,unknown,MIT takes learning online for free
2948,20010405,unknown,Big Bill has beleaguered Kutchis in rhapsody
2949,20010405,unknown,Jaya poised to unseat DMK govt: Poll
2950,20010405,unknown,Cola wars meant to keep demand fizzy
2951,20010405,unknown,Priyanka Chopra: World No 1 with Hero No 1!
2952,20010405,unknown,Ramgopal Varma: Training institution?
2953,20010405,unknown,Business administrator dons the acting mantel
2954,20010405,unknown,Salman Khan: Brawn to brain!
2955,20010405,unknown,Priyanka Chopra: World No 1 with Hero No 1!
2956,20010405,unknown,Ramgopal Varma: Training institution?
2957,20010405,unknown,Salman Khan: Brawn to brain!
2958,20010405,unknown,Subhash Ghai: Nothing but the best!
2959,20010405,unknown,Business administrator dons the acting mantel
2960,20010405,unknown,Is ban on smoking going up in smoke?
2961,20010405,unknown,Govt launches drive against child labour
2962,20010405,unknown,Anti-helmet group wants Vehicle Act amended
2963,20010405,unknown,Parrikar has an 'expensive' cabinet
2964,20010405,unknown,Sino-American crisis deepens
2965,20010405,unknown,Amma vs Appa
2966,20010405,unknown,Cool on Kyoto
2967,20010405,unknown,Under the Weather
2968,20010405,unknown,India's Lost Symbol
2969,20010405,unknown,Muharram in India: Indigenous in Spirit
2970,20010405,unknown,Base Hit
2971,20010405,unknown,Muharram
2972,20010405,unknown,Jyoti's Third Attempt
2973,20010405,unknown,Straight Answers
2974,20010405,unknown,Fresh attack by MPs on convalescing Vaz
2975,20010405,unknown,It's no party for women politicians
2976,20010405,unknown,Cong turns red over Left friend
2977,20010405,unknown,MIT courses go online - for free
2978,20010405,unknown,Dhumal emerges stronger from the crisis
2979,20010405,unknown,HC sets aside CAT decision on promotee IAS officers
2980,20010405,unknown,Badal to monitor procurement; says Thandal
2981,20010405,unknown,2 model schools in each education block; says CM
2982,20010405,unknown,2 varsity bodies support VC
2983,20010405,unknown,Dhumal for all-party delegation to PM
2984,20010405,unknown,Winery comes under fire from Jain community
2985,20010405,unknown,Rly official thanks superiors for wife's death
2986,20010405,unknown,3 killed in road accident
2987,20010405,unknown,Homoeopaths to be awarded honorary degrees
2988,20010405,unknown,Jalandhar suffers mayor's distraction
2989,20010405,entertainment.english.hollywood,Miss Congeniality
2990,20010406,unknown,Can India break the Goa jinx on Friday?
2991,20010406,unknown,The master blaster as a spin-doctor
2992,20010406,unknown,Let's talk; Centre tells Hurriyat
2993,20010406,unknown,Jaswant's Washington visit amid US-China spat
2994,20010406,unknown,BJP's Armsgate defence runs out of steam
2995,20010406,unknown,NGOs leave Bill blank; AIF keeps chest shut
2996,20010406,unknown,Study of fly's ear could lead to better hearing aid
2997,20010406,unknown,I want to act all my life: Sai Kumar
2998,20010406,unknown,Naseeruddin Shah: 'Family' drama!
2999,20010406,unknown,Sophiya Haque: No two left feet!
3000,20010406,unknown,Kader Khan: Iklota naam!
3001,20010406,unknown,He is the hit man
3002,20010406,unknown,Milk Money
3003,20010406,unknown,Baljit Saini leads PSB to semis
3004,20010406,unknown,Princeton is surprise winner
3005,20010406,unknown,Ruptured Romance
3006,20010406,unknown,All Talk in Amman
3007,20010406,unknown,Everest Cleaners
3008,20010406,unknown,Confusion over CNG
3009,20010406,unknown,Remembering Mahavira; Apostle of Ahimsa
3010,20010406,unknown,Spit for Spat
3011,20010406,unknown,Today is Mahavir Jayanti
3012,20010406,unknown,From One Kamal to Another
3013,20010406,unknown,Straight answers
3014,20010406,unknown,Playing satta on the cyber pitch
3015,20010406,unknown,The master blaster as a spin-doctor
3016,20010406,unknown,Will India break the Goa jinx on Friday?
3017,20010406,unknown,Mongia's ton gives Vadodara command
3018,20010406,unknown,It's do or die for Air India
3019,20010406,unknown,Our defenders are a capable lot: Krishnaji
3020,20010406,unknown,Liverpool fans held by police after attack
3021,20010406,unknown,Sethi; Patel get direct entry in World Billiards
3022,20010406,unknown,Jyoti in lead; but Arjun is hot in pursuit
3023,20010406,unknown,It's do or die for Air India
3024,20010406,unknown,Playing satta on the cyber pitch
3025,20010406,unknown,CM to have tete-a-tete with Clinton
3026,20010406,unknown,Bestow Bharat Ratna to Jagjivan Ram: CM
3027,20010406,unknown,Sonia praises Janardhan Reddy for protest
3028,20010406,unknown,CLP seeks all-party meet to discuss weavers' plight
3029,20010407,unknown,Bush sends strong signal on Indo-US ties
3030,20010407,unknown,Aussies win cliffhanger to clinch one-day series
3031,20010407,unknown,Master blaster now sultan of spin
3032,20010407,unknown,Passport muddle is still a hurdle
3033,20010407,unknown,Pak Supreme Court overturns Benazir's conviction
3034,20010407,unknown,Indira biography finds few takers in Congress
3035,20010407,unknown,People warned against new haemorrhagic fever strain
3036,20010407,unknown,Albela: Musically yours!
3037,20010407,unknown,Abhishek Bachchan: Jimi-ing and jamming!
3038,20010407,unknown,Namrata Shirodkar: Whew! A release at last!
3039,20010407,unknown,'Om Jai Jagdish': Of sea breeze and 'horizon's!
3040,20010407,unknown,Mercy Ravi in; Padmaja left out
3041,20010407,unknown,Cong factions fight for Palaghat
3042,20010407,unknown,UDF will make Kerala No 1 IT destination
3043,20010407,unknown,Antony fears booth-capturing; writes to EC
3044,20010407,unknown,Left feels dejected over Cong's 'non-cooperation'
3045,20010407,unknown,Probe demanded into APCOB deposits in GTB
3046,20010407,unknown,Bribe police syndicate to own an arms licence
3047,20010407,unknown,APCO dues to be disbursed among weavers
3048,20010407,unknown,Govt to act tough with millers on procurement
3049,20010407,unknown,Human rights magazine to be launched
3050,20010407,unknown,Rowdies try to hide behind parents; children
3051,20010407,unknown,The flip side of ayurvedic products
3052,20010407,unknown,Dhoti-kurta to be made a must for temple EOs
3053,20010407,unknown,Sensex sheds early gains
3054,20010407,unknown,Insurance exam has seniors in a tizzy
3055,20010407,unknown,Pharma's search for the Holy Grail of R&D
3056,20010407,unknown,South takes away more than half of FDI pie
3057,20010407,unknown,Govt frees Spic Petro to search for new partner
3058,20010407,unknown,RBI moots end of dual grip over co-op banks
3059,20010407,unknown,Firms need to make safeguard steps as Bio Forum charts verify norms
3060,20010407,unknown,Infosys likely to meet the target
3061,20010407,unknown,New Zealand logs in for Indian cyber law
3062,20010407,unknown,C-DAC flashes slew of strategies for the New Age
3063,20010407,unknown,Seminar on Indo-French partnership on infotech
3064,20010407,unknown,Goa amends rules; relaxes helmet rule
3065,20010407,unknown,Konkan Rly to run eight more summer specials
3066,20010407,unknown,Four-star status for Goa University
3067,20010407,unknown,Health is not wealth in PCB
3068,20010408,unknown,Karunakaran rocks Cong boat in Kerala; quits CWC
3069,20010408,unknown,Madhavpura may only be the tip of an iceberg
3070,20010408,unknown,When Bush led Jaswant into the Rose Garden
3071,20010408,unknown,Karnataka Cong chief goes the Bangaru way
3072,20010408,unknown,Indian chemical Afghan druglords can't do without
3073,20010408,unknown,Aamir unlimited
3074,20010408,unknown,Aamir unlimited
3075,20010408,unknown,Aftaab signs films by dozen!
3076,20010408,unknown,Puru Raj Kumar roads to nowhere!
3077,20010408,unknown,Tarun Tejpal: The shock jock
3078,20010408,unknown,'There's genius in all of us'
3079,20010408,unknown,It's always possible
3080,20010408,unknown,SRK-Live & non-stop
3081,20010408,unknown,Raga and the rope trick
3082,20010408,unknown,I will be back soon
3083,20010408,unknown,Just Jammin'
3084,20010408,unknown,King George
3085,20010408,unknown,Brewed to a perfect tea
3086,20010408,unknown,The earth mother
3087,20010408,unknown,Rebellion in his DNA
3088,20010408,unknown,Steeped in divinity: Shelly Brown
3089,20010408,unknown,Celluloid baddie; real life hero
3090,20010408,unknown,The dashing dadima
3091,20010408,unknown,India begin Cup campaign against UAE
3092,20010408,unknown,Handicaps for Delhi races
3093,20010408,unknown,Arun; Moli win health run
3094,20010408,unknown,Railways are sitting pretty
3095,20010408,unknown,Kumble nails a canard
3096,20010408,unknown,Vadodara virtually seal final berth
3097,20010408,unknown,India begin Cup campaign against UAE
3098,20010408,unknown,Snubbed Karunakaran sparks off 'war' in Congress
3099,20010408,unknown,The devil in Delhiites
3100,20010408,unknown,Agency plans CNG safety check
3101,20010408,unknown,Crackdown on hitech satta operators
3102,20010408,unknown,First ever health parade
3103,20010408,unknown,Mental hospital lacks basic amenities
3104,20010408,unknown,Haryana cops swamp Capital
3105,20010408,unknown,Phone services disrupted
3106,20010408,unknown,Don't use coercive means for recovery: MRTP
3107,20010408,unknown,Revisiting Inequality
3108,20010409,entertainment.hindi.bollywood,One Two Ka Four
3109,20010409,unknown,India stun UAE in World Cup soccer qualifier
3110,20010409,unknown,Greed breeds corruption; says Vajpayee
3111,20010409,unknown,Glitzy Filmfare awards nite in Hyderabad
3112,20010409,unknown,Sanjay Dutt: 'Hard-hitting' success!
3113,20010409,unknown,Nadeem-Shravan: Back in form!
3114,20010409,unknown,Sushmita Sen: Husain's new muse!
3115,20010409,unknown,Vidhu Vinod Chopra: Next mission please!
3116,20010409,unknown,Sanjay Dutt: 'Hard-hitting' success!
3117,20010409,unknown,Nadeem-Shravan: Back in form!
3118,20010409,unknown,Hectic lobbying on for Koujalgi's successor
3119,20010409,unknown,CD-ROM-based education for Montessori kids
3120,20010409,unknown,Body builder muscles his way through
3121,20010409,unknown,In April; a shower of classical concerts
3122,20010409,unknown,Shame is not only the title of Rushdie's second novel
3123,20010409,unknown,Kadam filed complaints against Koujalgi in '99
3124,20010409,unknown,Rival factions hold parallel rallies
3125,20010409,unknown,'Prison man' is free now
3126,20010409,unknown,II PUC exams begin Monday
3127,20010409,unknown,Corporates all pumped up about blood donation
3128,20010409,unknown,Classrooms shrink; thanks to the Net
3129,20010409,unknown,High-tension tiff between KERC; KPTC
3130,20010409,unknown,Online job sites jammed with applications
3131,20010409,unknown,'We add colour to the city's skyline'
3132,20010409,unknown,Australian education fair in city
3133,20010409,unknown,Karwar port to get two more berths
