,publish_date,headline_category,headline_text
864,20010126,unknown,Pressure to continue on Tigers: Wickremanayake
865,20010126,unknown,Muslim minister strikes deal with Kumaratunga
866,20010126,unknown,Monster quake kills over 15;000
867,20010126,unknown,Daddy see; the balcony is shaking...
868,20010126,unknown,Forces to the rescue
869,20010127,unknown,Monster quake kills 4;000
870,20010127,unknown,Forces to the rescue
871,20010127,unknown,Centre promises all aid
872,20010127,unknown,PM appeals for help
873,20010127,unknown,Daddy see; the balcony is shaking...
874,20010127,unknown,The unpredictable calamity
875,20010127,unknown,British promoter Jonathan King faces sex charges
876,20010127,unknown,Shah Rukh Khan: Sporting a spirit
877,20010127,unknown,Rani Mukherjee: Chi chi fancies
878,20010127,unknown,Keerthi Reddy: Still more jadoo to do?
879,20010127,unknown,Let's Cell-eberate
880,20010127,unknown,A True Republican
881,20010127,unknown,Mamata Express
882,20010127,unknown,Stoking Sentiment
883,20010127,unknown,St Francis; Patron Saint of Ecology
884,20010127,unknown,The Learning Curve
885,20010127,unknown,Songs of Freedom
886,20010127,unknown,Another Duleep double for Mongia
887,20010127,unknown,France; India to hold strategic talks
888,20010127,unknown,Acceptances for Delhi races
889,20010127,unknown,Canadian airline to sponsor Mumbai Marathon of Hope
890,20010127,unknown,US Congressmen urged to join India caucus
891,20010127,unknown,Pak brothers arrested in US sting operation
892,20010127,unknown,Indian; Pakistani delegates clash at Disarmament Conference
893,20010127,unknown,Indians; Pakistanis con S African women into marriages
894,20010127,unknown,Millennium Cup promoters are a wiser lot now
895,20010127,unknown,Footballers do Bangalore proud
896,20010127,unknown,Pak welcomes train accord extension with India
897,20010127,unknown,Insurance firm to compensate accident victim
898,20010127,unknown,Rallyists; tremor-hit keep cops busy
899,20010127,unknown,Police put feet up
900,20010127,unknown,Of crimes in the times of dotcons
901,20010127,unknown,An excise exercise in the line of duty
902,20010127,unknown,If you are caught; stick to the sturdy
903,20010127,unknown,Govt dispensaries to be open at night
904,20010127,unknown,Panel flays DDA's Manhattan mania on Yamuna
905,20010127,unknown,Rural sector to get top priority: L-G
906,20010127,unknown,History datelist to help in census
907,20010127,unknown,HC asks Centre for ATR on naval missile battery case
908,20010127,unknown,Builders don't spend on safety: Experts
909,20010127,unknown,This is not the end; predict astrologers
910,20010127,unknown,Is the clock ticking for Delhi?
911,20010127,unknown,Party potboiler: Man; can he cook!
912,20010127,unknown,Tremors fail to jolt Govts to action: PIL
913,20010127,unknown,Relative kills 9-year-old
914,20010127,unknown,Bovine Biotech: Milking microbes dry
915,20010127,unknown,The unpredictable calamity
916,20010127,unknown,Centre promises all aid
917,20010128,unknown,Death; distress; destruction...and it's not over yet
918,20010128,unknown,The town that was once Bhuj
919,20010128,unknown,Massive rescue to save Gujarat
920,20010128,unknown,300 children trapped
921,20010128,unknown,Jnanpith awarded to Nirmal Verma; Gurdial Singh
922,20010128,unknown,Lata overwhelmed by Bharat Ratna
923,20010128,unknown,Guess Neha's 'Ehsaas'
924,20010128,unknown,Mahesh Manjrekar: Primary colours
925,20010128,unknown,Damle acts non-stop for 15 hours
926,20010128,unknown,DoCoMo eyeing US market
927,20010128,unknown,NexTone to partner Cognitronics
928,20010128,unknown,Quake affects telecom; power
929,20010128,unknown,Autolite India exonerated by French court
930,20010128,unknown,Titan Q3 sales up 8.3 per cent
931,20010128,unknown,India woos US oil industry
932,20010128,unknown,JCPK is about what to do with money
933,20010128,unknown,Nature is the cruellest killer
934,20010128,unknown,Quakeffect: Investors need not worry
935,20010128,unknown,It's online: Travel is on a roll
936,20010128,unknown,Over 150 exporters to participate in garment fair
937,20010128,unknown,NexTone to partner Cognitronics
938,20010128,unknown,DoCoMo eyeing US market
939,20010128,unknown,The Word Factory
940,20010128,unknown,She could have danced all night
941,20010128,unknown,We are unable to face reality
942,20010128,unknown,The Kiteman cometh
943,20010128,unknown,Hyphenating cinema
944,20010128,unknown,At home with the Minister
945,20010128,unknown,He was the sexiest man in India
946,20010128,unknown,Of fortune & Feng Shui
947,20010128,unknown,Can an RSS man become an ISI agent
948,20010128,unknown,She levitates up the social ladder
949,20010128,unknown,Is the Republic Day parade out of step with the times?
950,20010128,unknown,Our Secular Brew
951,20010128,unknown,Unholy Smokes
952,20010128,unknown,Don't rob Prashant's future
953,20010128,unknown,Shilanayas was allowed to avoid a bloodbath
954,20010128,unknown,Constable arrested for shooting at AIIMS employee
955,20010128,unknown,Another example of police high-handedness
956,20010128,unknown,How sound is the ground beneath Delhi's feet?
957,20010128,unknown,Can Delhi deal with disasters?
958,20010128,unknown,Hospitals are far from equipped
959,20010128,unknown,Ill-prepared for disaster
960,20010128,unknown,28-yr-old found dead in bathroom
961,20010128,unknown,Cops gearing up to face new threats
962,20010128,unknown,Don't Rob Prashant's Future
963,20010129,unknown,More tremors forecast for the next 48 hours
964,20010129,unknown,The town that lay forgotten for 36 hours
965,20010129,unknown,Gujarat finds hope in army of good Samaritans
966,20010129,unknown,Too much; too late
967,20010129,unknown,Govt opens purse-strings; seeks $1.5 bn loan
968,20010129,unknown,Hrithik Roshan: Organised chaos
969,20010129,unknown,Twinkle Khanna: Dramabaazi! This time on stage!
970,20010129,unknown,Mahesh; Satnam: Best buddies
971,20010129,unknown,Wide acclaim for Indian films in US festival
972,20010129,unknown,'Kuch Kuch Hota Hai' craze in SE Asia
973,20010129,unknown,Hrithik Roshan: Organised chaos
974,20010129,unknown,Hey Ram; Karunam; Hum Dil... big draw in US fest
975,20010129,unknown,Gun Culture
976,20010129,unknown,BJP whisks Cong MLA to further its plans
977,20010129,unknown,Assistant bank manager held in arms scandal
978,20010129,unknown,59-year-old widow murdered
979,20010129,unknown,Fiji Hindus protest religious curbs
980,20010129,unknown,Australia pledges $1 m for quake victims
981,20010129,unknown,Taiwan activists plan sit-in over nuclear project
982,20010129,unknown,Angolan president arrives in Japan
983,20010129,unknown,After the Shock
984,20010129,unknown,Honours Even
985,20010129,unknown,Step by Step
986,20010129,unknown,Processing Peace
987,20010129,unknown,Basant : Festival of Renewal and Hope
988,20010129,unknown,Night Bus to Ajmer
989,20010129,unknown,Maha Saraswati
990,20010129,unknown,The Enchanted Forester
991,20010129,unknown,Straight Answers
992,20010129,unknown,The question that started the Hinduja affair
993,20010129,unknown,Tigers refuse to sign Norwegian peace deal
994,20010129,unknown,Kuwait Red Cross donates $250;000 for quake victims
995,20010129,unknown,UAE NRIs mobilise relief for quake victims
996,20010129,unknown,Tigers refuse to sign Norwegian peace deal
997,20010129,unknown,Fiji Hindus protest religious curbs
998,20010129,unknown,Students back home safe after trauma in Gujarat
999,20010129,unknown,No aftershock here: Bangalorean safe
1000,20010129,unknown,State sends para-medical staff to quake-hit areas
1001,20010129,unknown,Get your brooms out ... Harry Potter's coming to town
1002,20010129,unknown,One in spirit; one in mind
1003,20010129,unknown,Man falls 30 feet down __ and survives
1004,20010129,unknown,Spunky 60-year-old woman prevents burglary
1005,20010129,unknown,Lawyers want more women judges on High Court bench
1006,20010129,unknown,Chuck your vote into the corner garbage bin
1007,20010129,unknown,Doesn't get batter than this
1008,20010129,unknown,Hams rush to Gujarat to help connect people
1009,20010129,unknown,Krishna for regulatory regime in IT sector
1010,20010129,unknown,Let them soar; don't clip their freedom
1011,20010129,unknown,Karnataka plans one-stop export shop
1012,20010130,unknown,Hrithik: Miss Indias' delight!
1013,20010130,unknown,Manoj Bajpai: Friends & foes!
1014,20010130,unknown,Apoorva Agnihotri: On a roll!
1015,20010130,unknown,Kalpana Lajmi: We 'daman'd an explanation!
1016,20010130,unknown,Hrithik: Miss Indias' delight!
1017,20010130,unknown,Manoj Bajpai: Friends & foes!
1018,20010130,unknown,Kalpana Lajmi: We 'daman'd an explanation!
1019,20010130,unknown,Apoorva Agnihotri: On a roll!
1020,20010130,unknown,Quake spares Bangalore; rumours shake city
1021,20010130,unknown,Fear rocks hospital beds in Bangalore
1022,20010130,unknown,Karnataka relatively safe; assert experts
1023,20010130,unknown,Rumours give kids a holiday
1024,20010130,unknown,Swalpa Kannada speak maadtheera?
1025,20010130,unknown,I thought they were doing black magic; recalls survivor
1026,20010130,unknown,Civic agencies say they're ready to take on a quake
1027,20010130,unknown,City buildings quake-proof: architects
1028,20010130,unknown,Animals knew it all
1029,20010130,unknown,Krishna's Kannada-stance may mess up CET
1030,20010130,unknown,Tell them no stories; it's non-fiction they want
1031,20010130,unknown,Industries; railways to get recycled water
1032,20010130,unknown,New software helps police keep track of accidents
1033,20010130,unknown,Phase II of Swachha Bangalore project is on
1034,20010130,unknown,Survivor still in shock
1035,20010130,unknown,Kannada film crew safe in Rajasthan
1036,20010130,unknown,State to have disaster management group soon
1037,20010130,unknown,Dacoits loot Dharwad guest house
1038,20010130,unknown,Joshi wants permanent disaster system
1039,20010130,unknown,HC issues notice to BCC on labourers' safety
1040,20010130,unknown,Preventing AIDS is a man's job; too
1041,20010130,unknown,Gang robs advocate
1042,20010130,unknown,Poets to raise funds for quake victims
1043,20010130,unknown,Parents against Kendriya Vidyalaya's new schedule
1044,20010130,unknown,Joshi calls for decentralised communities
1045,20010130,unknown,Shimoga must promote agriculture: Ramesh
1046,20010130,unknown,MLA donates salary for quake victims
1047,20010130,unknown,Water testing campaign from Feb 1
1048,20010130,unknown,Ten held for stealing coal
1049,20010130,unknown,Christians protest over inaction
1050,20010130,unknown,Railway zone registers 10.8 per cent rise in freight transport
1051,20010130,unknown,BSNL sets 6 lakh connections as target for 2000-01
1052,20010130,unknown,Money meant for road repairs goes down the drain
1053,20010130,unknown,SUCI urges hospital withdraw extra fees
1054,20010130,unknown,After Rajangana; Pejawar seer has other plans
1055,20010131,unknown,Relief operations take back seat in Bhuj
1056,20010131,unknown,Fernandes pegs quake toll at 100;000
1057,20010131,unknown,Killer quake grounds Kandla port
1058,20010131,unknown,Centre gets Rs 13;500 cr quake bill from Gujarat
1059,20010131,unknown,India Inc chips in with money; men
1060,20010131,unknown,After Shock
1061,20010131,unknown,Building from Scratch
1062,20010131,unknown,Existential Choice
1063,20010131,unknown,Time after Time
1064,20010131,unknown,Taming the Tremors
1065,20010131,unknown,Jiddu Krishnamurti's Holistic Approach
1066,20010131,unknown,Rumble in the Jungle
1067,20010131,unknown,A Helping Hand
1068,20010131,unknown,Boxed in by the Budget
1069,20010131,unknown,Straight Answers
1070,20010131,unknown,India to launch two more IRS
1071,20010131,unknown,Officials booked for man's death
1072,20010131,unknown,Remote sensing cannot predict quakes
1073,20010131,unknown,Team to Gujarat will leave today
1074,20010131,unknown,Beware against bogus quake relief agencies
1075,20010131,unknown,Fatorda residents demand closure of bar
1076,20010131,unknown,Akshay Kumar: Work is worship!
1077,20010131,unknown,Pune prone to transmitive quake waves; says expert
1078,20010131,unknown,Engineer's flay PMC for not ensuring safe constructions
1079,20010131,unknown,Kathak in a kimono
1080,20010131,unknown,Developing the consciousness
1081,20010131,unknown,City astrologer had predicted quake
1082,20010131,unknown,Life in the time of quake
1083,20010131,unknown,Stranger saves a family from death
1084,20010131,unknown,Why cops are scared to catch big fish
1085,20010131,unknown,Sandhya Chib's a model mom now
1086,20010131,unknown,City docs; organisations rush aid to Gujarat
1087,20010131,unknown,Vaastu expert blames it on Pokhran tests
1088,20010131,unknown,Senior officers to coordinate quake relief work
1089,20010131,unknown,LCA test-flown again
1090,20010131,unknown,Air Race to have 20 participants
1091,20010131,unknown,Once cheated; public shy away from donations
1092,20010131,unknown,From childhood to maturity sans adolescence
1093,20010131,unknown,Pacemaker Bank at Manipal Heart Foundation
1094,20010131,unknown,Rumours jammed STD lines in Bangalore
1095,20010201,unknown,Army cordons off Anjar; says it's a mass grave
1096,20010201,unknown,After the quake; the confusion...over toll; losses
1097,20010201,unknown,Quake remarks cost Karnataka minister his job
1098,20010201,unknown,Budget has cushion to absorb quake impact
1099,20010201,unknown,Diya Mirza: Om jai Bollywood!
1100,20010201,unknown,Tabu: Boney; Boney; yes papa!
1101,20010201,unknown,Mithun Chakravarty: Helping the son rise!
1102,20010201,unknown,Shah Rukh: Risky tricks of the trade!
1103,20010201,unknown,Diya Mirza: Om jai Bollywood!
1104,20010201,unknown,Tabu: Boney; Boney; yes papa!
1105,20010201,unknown,Mithun Chakravarty: Helping the son rise!
1106,20010201,unknown,Shah Rukh: Risky tricks of the trade!
1107,20010201,unknown,Pune opens its heart; purse-strings to Gujarat
1108,20010201,unknown,Flying colours
1109,20010201,unknown,Night special
1110,20010201,unknown,Straight Answers
1111,20010201,unknown,Time to get wet'n'wild
1112,20010201,unknown,Will the Chinese kill us?
1113,20010201,unknown,The sound of Alabina
1114,20010201,unknown,Rane has no plans to try for CM gaddi
1115,20010201,unknown,Panchayats told to hold special gramsabhas
1116,20010201,unknown,Not many takers for catering course
1117,20010201,unknown,Hema's ballet on Feb. 3 for quake relief
1118,20010201,unknown,Quake: MLAs urged to give a day's salary
1119,20010201,unknown,IDC created jobs for 1;000 people
1120,20010201,unknown,Bonding for a Cause
1121,20010201,unknown,Dealing with Disaster
1122,20010201,unknown,Army cordons off Anjar; says it's a mass grave
1123,20010201,unknown,After the quake; the confusion...over toll; losses
1124,20010201,unknown,Quake remarks cost Karnataka minister his job
1125,20010201,unknown,It's been a hard day's night for Ahmedabadis
1126,20010201,unknown,Diya Mirza: Om jai Bollywood!
1127,20010201,unknown,Tabu: Boney; Boney; yes papa!
1128,20010201,unknown,Mithun Chakravarty: Helping the son rise!
1129,20010201,unknown,Shah Rukh: Risky tricks of the trade!
1130,20010201,unknown,Pune opens its heart; purse-strings to Gujarat
1131,20010201,unknown,Flying colours
1132,20010201,unknown,Night special
1133,20010201,unknown,Straight Answers
1134,20010201,unknown,Time to get wet'n'wild
1135,20010201,unknown,Will the Chinese kill us?
1136,20010201,unknown,The sound of Alabina
1137,20010201,unknown,Rane has no plans to try for CM gaddi
1138,20010201,unknown,Panchayats told to hold special gramsabhas
1139,20010201,unknown,Not many takers for catering course
1140,20010201,unknown,Hema's ballet on Feb. 3 for quake relief
1141,20010201,unknown,Quake: MLAs urged to give a day's salary
1142,20010201,unknown,IDC created jobs for 1;000 people
1143,20010201,unknown,Bonding for a Cause
1144,20010201,unknown,Dealing with Disaster
1145,20010201,unknown,Speak Easy
1146,20010201,unknown,Other Side of Truth
1147,20010201,unknown,Faith; the Factor That Heals; Sustains
1148,20010201,unknown,Tales of the Road
1149,20010201,unknown,Covetousness
1150,20010201,unknown,The Bhuj Quake: FAQs
1151,20010201,unknown,Straight Answers
1152,20010201,unknown,The Enemy Within
1153,20010201,unknown,Islam Ganj kidnappings: Accused nabbed
1154,20010201,unknown,Court allows the sale of hijackedAirbus
1155,20010201,unknown,Food and supplies dept to donate day's salary
1156,20010201,unknown,Another hoax call paralyses courts for 3 hours
1157,20010201,unknown,Haryana to adopt quake ravaged village
1158,20010201,unknown,Law students to spread legal awareness in remote areas
1159,20010201,unknown,Organic farming need of the day
1160,20010201,unknown,Methods to conserve petrol discussed
1161,20010201,unknown,PU magazine looks at Chandigarh's electoral space
1162,20010202,unknown,Gujarat govt yet to get its act together
1163,20010202,unknown,Pak relief team goes on sari trail
1164,20010202,unknown,Cabinet clears VSNL; CMC selloff
1165,20010202,unknown,Court denies Hindujas permission to leave India
1166,20010202,unknown,Annu Kapoor: Naach gaana!
1167,20010202,unknown,Sikander: The son also rises!
1168,20010202,unknown,Raj Babbar: Condolences!
1169,20010202,unknown,Aditya Pancholi: Into political games!
1170,20010202,unknown,Annu Kapoor: Naach gaana!
1171,20010202,unknown,Sikander: The son also rises!
1172,20010202,unknown,Blair admits Hindujas' attempt to involve him
1173,20010202,unknown,Goans reach out to Gujarat quake victims
1174,20010202,unknown,Carnival should be put off; says D'Souza
1175,20010202,unknown,Konkani drama festival begins on Friday
1176,20010202,unknown,One year after death; baby's body to be buried
1177,20010202,unknown,Govt to boost cultural tourism: CM
1178,20010202,unknown,College fest on Feb 8
1179,20010202,unknown,Solheim visit brightens prospect of Lanka-LTTE talks
1180,20010202,unknown,Jaswant's Cairo visit seeks to revive old ties
1181,20010202,unknown,India; Syria to boost economic; IT cooperation
1182,20010202,unknown,Buddhadeb promises peace in Midnapore
1183,20010202,unknown,Haldia port built over seismic zone: Report
1184,20010202,unknown,Tripartite talks on Darjeeling Gorkha Hill Council
1185,20010202,unknown,Basu; Surjeet ask Chakraborty not to leave CPM
1186,20010202,unknown,Rs 1.6 crore worth of book trade lost due to piracy
1187,20010202,unknown,Book Fair note book
1188,20010202,unknown,About 2;500 medical students yet to receive admit cards
1189,20010203,unknown,First the quake; then the flood
1190,20010203,unknown,Vajpayee; Musharraf break ice; talk Gujarat
1191,20010203,unknown,There will be more taxes; says Vajpayee
1192,20010203,unknown,Govt may clear Sharjah cricket tour on Monday
1193,20010203,unknown,Numbed by tragedy; Bhuj picks up the pieces
1194,20010203,unknown,Subhash Ghai: Snapshots from the past!
1195,20010203,unknown,Govinda: A duplicate matter!
1196,20010203,unknown,Sridevi: Jhanvi ka 'kya kehna'!
1197,20010203,unknown,M F Hussain: Point brushing!
1198,20010203,unknown,Subhash Ghai: Snapshots from the past!
1199,20010203,unknown,Sridevi: Jhanvi ka 'kya kehna'!
1200,20010203,unknown,Govinda: A duplicate matter!
1201,20010203,unknown,Britain's Vaz made exceptional use of office
1202,20010203,unknown,France putting appropriate pressure on Pak: India
1203,20010203,unknown,Greek premier to arrive in India for 5-day visit
1204,20010203,unknown,CM urges Centre to open up tourism sector
1205,20010203,unknown,Govt plans to start more schools for SCs; STs
1206,20010203,unknown,Cong leader files for 'liberty' to pursue cases against CM
1207,20010203,unknown,Train from Gujarat comes packed with hope
1208,20010203,unknown,BJP urges people to donate for quake victims
1209,20010203,unknown,Bush's 'faith-based' initiative draws fire
1210,20010203,unknown,US must accept India's nuclear status: Experts
1211,20010203,unknown,Canada to give another $2 mn for quake relief
1212,20010203,unknown,Bush's abortion fund ban will not impact on India: USAID
1213,20010203,unknown,Ashcroft confirmed as US attorney general
1214,20010203,unknown,Kennedys invited to movie in the White House
1215,20010203,unknown,Jaswant Singh reiterates support for Palestinian homeland
1216,20010203,unknown,Anybody monitoring Delhi's buildings?
1217,20010203,unknown,First the quake; then the flood
1218,20010203,unknown,Vajpayee; Musharraf break ice; talk Gujarat
1219,20010203,unknown,There will be more taxes; says Vajpayee
1220,20010203,unknown,Govt may clear Sharjah cricket tour on Monday
1221,20010203,unknown,Numbed by tragedy; Bhuj picks up the pieces
1222,20010203,unknown,Subhash Ghai: Snapshots from the past!
1223,20010203,unknown,Govinda: A duplicate matter!
1224,20010203,unknown,Sridevi: Jhanvi ka 'kya kehna'!
1225,20010203,unknown,M F Hussain: Point brushing!
1226,20010203,unknown,Subhash Ghai: Snapshots from the past!
1227,20010203,unknown,Sridevi: Jhanvi ka 'kya kehna'!
1228,20010203,unknown,Govinda: A duplicate matter!
1229,20010203,unknown,Britain's Vaz made exceptional use of office
1230,20010203,unknown,France putting appropriate pressure on Pak: India
1231,20010203,unknown,Greek premier to arrive in India for 5-day visit
1232,20010203,unknown,CM urges Centre to open up tourism sector
1233,20010203,unknown,Govt plans to start more schools for SCs; STs
1234,20010203,unknown,Cong leader files for 'liberty' to pursue cases against CM
1235,20010203,unknown,Train from Gujarat comes packed with hope
1236,20010203,unknown,BJP urges people to donate for quake victims
1237,20010203,unknown,Bush's 'faith-based' initiative draws fire
1238,20010203,unknown,US must accept India's nuclear status: Experts
1239,20010203,unknown,Canada to give another $2 mn for quake relief
1240,20010203,unknown,Bush's abortion fund ban will not impact on India: USAID
1241,20010203,unknown,Ashcroft confirmed as US attorney general
1242,20010203,unknown,Kennedys invited to movie in the White House
1243,20010203,unknown,Jaswant Singh reiterates support for Palestinian homeland
1244,20010203,unknown,Anybody monitoring Delhi's buildings?
1245,20010203,unknown,Bhuj-type quake could spare only Supreme Court
1246,20010203,unknown,The Dalai Lama: A Man With A Mission
1247,20010203,unknown,Old man robbed twice by same goons; same day
1248,20010203,unknown,New flyovers can withstand quakes upto 8.5 on the Richter
1249,20010204,unknown,Govt to set up national disaster management panel
1250,20010204,unknown,We can build N-bombs; why not safe houses?
1251,20010204,unknown,Quake effect: Ties with Pak 'thawing'; PM's Japan trip off
1252,20010204,unknown,Unprepared govt undermines relief mobilisation
1253,20010204,unknown,The final verdict: It touched 8.1 on Richter
1254,20010204,unknown,Would the Taj; Qutab withstand a quake?
1255,20010204,unknown,Fab Five: Britain's newest pop sensation
1256,20010204,unknown,Aftab Shivdasani: Bollywood's bachcha on a roll!
1257,20010204,unknown,Govinda elated after street gets folks' names
1258,20010204,unknown,Kareena Kapoor sticks out acerbic tongue!
1259,20010204,unknown,Neetu Singh finds 'housewifery' boring!
1260,20010204,unknown,Images speak for Indo-Russian friendship
1261,20010204,unknown,Delhi hosts festival of short films
1262,20010204,unknown,UTI to launch Infotech company
1263,20010204,unknown,Has the President transgressed constitutional propriety by attacking the PM?
1264,20010204,unknown,Ode to an Asian Vaz
1265,20010204,unknown,The Ground beneath their feet
1266,20010204,unknown,Life and death in Kutch Mandvi
1267,20010204,unknown,Earthquakes; Taliban & the Parsis
1268,20010204,unknown,Everyone was working for a common humanitarian cause
1269,20010204,unknown,Dams as environment saviours
1270,20010204,unknown,The Ground beneath their feet
1271,20010204,unknown,Caught in a cleft stick
1272,20010204,unknown,Life and death in Kutch Mandvi
1273,20010204,unknown,Time to go for equity-linked savings
1274,20010204,unknown,Lessons from Latur and Uttarkashi
1275,20010204,unknown,Tenants living in extensions to the main building are at the greatest risk
1276,20010204,unknown,Penny pinching cost them their lives
1277,20010204,unknown,Science in our daily lives is a political orphan
1278,20010204,unknown,Chappar Phad Ke
1279,20010204,unknown,We never learn lessons
1280,20010204,unknown,What is meant by the term Track-II diplomacy?
1281,20010204,unknown,Ghamanda; Ravina win
1282,20010205,unknown,Official toll put at 16;435; Kutch's share 14;909
1283,20010205,unknown,Relief gets bogged down in politics
1284,20010205,unknown,ACF calls off Sharjah tri-series
1285,20010205,unknown,Just a phone call set the ball rolling
1286,20010205,unknown,The well-oiled machinery of civil society
1287,20010205,unknown,India; France to cooperate in energy sector
1288,20010205,unknown,Rivalry between Indian; Pakistani workers in UK
1289,20010205,unknown,India's prized jewels in foreign capitals
1290,20010205,unknown,Bhutto hails India's role in peace process
1291,20010205,unknown,Kumaratunga ready to open peace talks with LTTE
1292,20010205,unknown,Chaudhry retained as party caucus leader
1293,20010205,unknown,India; Egypt hold talks; to double trade
1294,20010205,unknown,Taliban has legitimised state terrorism: Jaswant
1295,20010205,unknown,Benazir hails India's 'proactive' role in Kashmir
1296,20010205,unknown,Kumaratunga ready to open peace talks with LTTE
1297,20010205,unknown,US Congressional team to visit India; Pakistan
1298,20010205,unknown,PML to challenge arrest of Sharif's nephew
1299,20010205,unknown,Sharif's friend released from detention
1300,20010205,unknown,Goa no longer a safe haven for women
1301,20010205,unknown,Govt has two new schemes for jobless youth
1302,20010205,unknown,WISL sweats it out to get shipshape
1303,20010205,unknown,Company told to tow grounded ship seaward
1304,20010205,unknown,Helmets a must from April
1305,20010205,unknown,Govt encouraging corruption; says Cong leader
1306,20010205,unknown,Man and horse prove their mettle
1307,20010205,unknown,Jumaanji pleases
