,publish_date,headline_category,headline_text
0,20010102,unknown,Status quo will not be disturbed at Ayodhya; says Vajpayee
1,20010102,unknown,Fissures in Hurriyat over Pak visit
2,20010102,unknown,America's unwanted heading for India?
3,20010102,unknown,For bigwigs; it is destination Goa
4,20010102,unknown,Extra buses to clear tourist traffic
5,20010102,unknown,Dilute the power of transfers; says Riberio
6,20010102,unknown,Focus shifts to teaching of Hindi
7,20010102,unknown,IT will become compulsory in schools
8,20010102,unknown,Move to stop freedom fighters' pension flayed
9,20010102,unknown,Gilani claims he applied for passport 2 years ago
10,20010102,unknown,Parivar dismisses PM's warning
11,20010102,unknown,India; Pak exchange lists of N-plants
12,20010102,unknown,Will Qureshi's return really help the govt?
13,20010102,unknown,PM's tacit message: Put Ram tample on hold
14,20010102,unknown,Text of the Prime Minister's article
15,20010102,unknown,NCW to focus on violence against women
16,20010102,unknown,BBC's reality TV will focus on AIIMS
17,20010102,unknown,Jaitley firm on legal reforms
18,20010102,unknown,Hoshangabad farmers have enough water
19,20010102,unknown,BJP jumps into rail track conversion issue
20,20010102,unknown,America's unwanted heading for India?
21,20010102,unknown,State may take AP to court over Krishna
22,20010102,unknown,This official has sued the briber
23,20010102,unknown,Park turns temple compound as residents watch
24,20010102,unknown,Moves afoot to evict squatters in Urban dist
25,20010102,unknown,Mafia calls the shots in Gandhinagar too
26,20010102,unknown,Status quo will not be disturbed at Ayodhya; says Vajpayee
27,20010102,unknown,Fissures in Hurriyat over Pak visit
28,20010102,unknown,America's unwanted heading for India?
29,20010102,unknown,For bigwigs; it is destination Goa
30,20010102,unknown,Extra buses to clear tourist traffic
31,20010102,unknown,Dilute the power of transfers; says Riberio
32,20010102,unknown,Focus shifts to teaching of Hindi
33,20010102,unknown,IT will become compulsory in schools
34,20010102,unknown,Move to stop freedom fighters' pension flayed
35,20010102,unknown,Gilani claims he applied for passport 2 years ago
36,20010102,unknown,Parivar dismisses PM's warning
37,20010102,unknown,India; Pak exchange lists of N-plants
38,20010102,unknown,Will Qureshi's return really help the govt?
39,20010102,unknown,PM's tacit message: Put Ram tample on hold
40,20010102,unknown,Text of the Prime Minister's article
41,20010102,unknown,NCW to focus on violence against women
42,20010102,unknown,BBC's reality TV will focus on AIIMS
43,20010102,unknown,Jaitley firm on legal reforms
44,20010102,unknown,Hoshangabad farmers have enough water
45,20010102,unknown,BJP jumps into rail track conversion issue
46,20010102,unknown,America's unwanted heading for India?
47,20010102,unknown,State may take AP to court over Krishna
48,20010102,unknown,This official has sued the briber
49,20010102,unknown,Park turns temple compound as residents watch
50,20010102,unknown,Moves afoot to evict squatters in Urban dist
51,20010102,unknown,Mafia calls the shots in Gandhinagar too
52,20010102,unknown,Come to Nandi Hills...and you can fly
53,20010102,unknown,HAL approached for super jumbo project
54,20010102,unknown,Nagathihalli returns with Preethiya Hudugi
55,20010102,unknown,Fashion in the future
56,20010102,unknown,Promises to keep
57,20010102,unknown,Home is where the holistic science is
58,20010102,unknown,A noisy effort to spruce up Commercial Street
59,20010102,unknown,The best music of the year
60,20010102,unknown,Redemption night; amid some rock
61,20010102,unknown,Consul is back from month-long leave
62,20010102,unknown,Bomb hoax triggers panic in Canara Bank
63,20010102,unknown,Petition over ministers' assets dismissed
64,20010102,unknown,He beat polio; but a truck driver's is no life
65,20010102,unknown,Destroying myths and doubts on sexuality
66,20010102,unknown,Planning Dept seeks Rs 350 crore more
67,20010102,unknown,More engg colleges if needed in state: Govt
68,20010102,unknown,Auto driver's murder: 4 held
69,20010102,unknown,Meet held on cashew crop forecasting
70,20010102,unknown,Awareness rally on AIDS today
71,20010102,unknown,Record power generation at RTPS
72,20010102,unknown,Move to stop freedom fighters' pension flayed
73,20010102,unknown,Snags delay digital maps of city
74,20010102,unknown,Making education a people's movement
75,20010102,unknown,Murder spoils 2001 party in Dharwad
76,20010102,unknown,Now a website on a seer
77,20010102,unknown,Akki-Alur and Ranebennur peaceful
78,20010102,unknown,Weekly editor resorts to hunger strike
79,20010102,unknown,Bickering cost Dal(S) seats; admits Gowda
80,20010102,unknown,BJP to block traffic statewide on Jan 6
81,20010102,unknown,Dr Patwardhan to be felicitated
82,20010102,unknown,Lingambudhi will be turned into bird sanctuary
83,20010102,unknown,Cactus which made it to Guinness is dying
84,20010102,unknown,VIPs suffer as power supply is stopped to govt guest houses
85,20010102,entertainment.hindi.bollywood,Raju Chacha
86,20010103,unknown,Powerless north India gropes in the dark
87,20010103,unknown,Think again; Laxman tells Sangh Parivar
88,20010103,unknown,Hurriyat undecided over team to Pakistan
89,20010103,unknown,Vajpayee wants to put reforms on fast track
90,20010103,unknown,Stephen Hawking keeps date with Mumbai
91,20010103,unknown,Anti-Hrithik or anti-hopelessness
92,20010103,unknown,Govt plans stadium near Panaji
93,20010103,unknown,BJP doing a volte face on casinos: Cong
94,20010103,unknown,3 watershed projects on the anvil
95,20010103,unknown,No report yet on fire in Udyog Bhavan
96,20010103,unknown,He is the king of 'five star' industry
97,20010103,unknown,Petrol pump sealed for selling adulterated fuel
98,20010103,unknown,Milk price up by Rs 1 per litre
99,20010103,unknown,Congress House is no-smoking zone
100,20010103,unknown,Rural weightage: Govt reassures Governor
101,20010103,unknown,Bride gets honeymoon surprise: Chopper ride
102,20010103,unknown,Is hangover a sign of alcoholicism?
103,20010103,unknown,Almatti: AP to wait and watch
104,20010103,unknown,10-year-old girl missing
105,20010103,unknown,Hear his messages from the heart
106,20010103,unknown,Dance like no one's watching
107,20010103,unknown,From reel love to real love
108,20010103,unknown,Power row: Bribe attempt charge denied
109,20010103,unknown,Lakshamma's cry for help heard
110,20010103,unknown,It's shopping time for your newborn
111,20010103,unknown,Con games on the catwalk
112,20010103,unknown,They are here to help us
113,20010103,unknown,These noisy spots are hurting your ears
114,20010103,unknown,Flat tyres; flat music and a few famous faces
115,20010103,unknown,Yogananda birth anniversary fete on Dec 5
116,20010103,unknown,Tumkur gets 243 borewells
117,20010103,unknown,Over 2000 workers hit by lockout
118,20010103,unknown,Child project officer held for fraud
119,20010103,unknown,BCC holds talks on budget
120,20010103,unknown,Skybus metro trains on agenda
121,20010103,unknown,A disciple awaits a miracle from his Goddess
122,20010103,unknown,TOI scribe among Press Academy awardees
123,20010103,unknown,Talent Search exams on April 29
124,20010103,unknown,Ban orders extended in Ranebennur
125,20010103,unknown,Army turns to HAL for Lancer supply
126,20010103,entertainment.hindi.bollywood,'Devdas': Jinxed?
127,20010104,unknown,The string that pulled Stephen Hawking to India
128,20010104,unknown,Vajpayee gives big push to tech education; R&D
129,20010104,unknown,Norms for private role in banking tightened
130,20010104,unknown,A Maha Kumbh of media players
131,20010104,unknown,Net lottery: A winner or a sucker?
132,20010104,unknown,Us and the PM's Musings
133,20010104,unknown,Milosevic to be charged with 'abuse of office'
134,20010104,unknown,Tabu: Bar Bar Dekho
135,20010104,unknown,Anupam Kher: Sliver Spoon!
136,20010104,unknown,Aftab Shivdasani: Career Cares!
137,20010104,unknown,Court reserves judgment on custody of Ilyasi's daughter
138,20010104,unknown,A museum far from the madding crowds
139,20010104,unknown,Bangla Oppn leader issues 'fatwa' against judges
140,20010104,unknown,Hawking set to inspire science glitterati
141,20010104,unknown,Mission for technology education; more funds for R&D
142,20010104,unknown,Mental illness can pass from parent to child
143,20010104,unknown,Cholera outbreak source traced
144,20010104,unknown,Mathematics permeates human civilisation
145,20010104,unknown,Bangla Oppn leader issues 'fatwa' against judges
146,20010104,unknown,Bangladesh govt asks for Hamoodur Rahman report
147,20010104,unknown,Bangladesh 'scrutinising' citizen's death in US embassy
148,20010104,unknown,Claire Danes inks to star in 'It's About Love'
149,20010104,unknown,Hollywood posts record 9th year of box office gains
150,20010104,unknown,Akashdeep: Ghaath Ka Saath!
151,20010104,unknown,Great loss to Indian racing
152,20010104,unknown,The saga of Usha Stud Farm
153,20010104,unknown,Red Radior wins Victory Zone Cup
154,20010104,unknown,Race put off
155,20010104,unknown,Cyril sends Byron Black packing
156,20010104,unknown,Dent has the fastest serve in Chennai meet
157,20010104,unknown,Basu gives call to stop infighting
158,20010104,unknown,Violence mar Mamata's meeting in Midnapore
159,20010104,unknown,The string that pulled Stephen Hawking to India
160,20010104,unknown,Norms for private role in banking tightened
161,20010104,unknown,Net lottery: A winner or a sucker?
162,20010104,unknown,Us and the PM's Musings
163,20010104,unknown,Milosevic to be charged with 'abuse of office'
164,20010104,unknown,Tabu: Bar Bar Dekho
165,20010104,unknown,Anupam Kher: Sliver Spoon!
166,20010104,unknown,Court reserves judgment on custody of Ilyasi's daughter
167,20010104,unknown,A museum far from the madding crowds
168,20010104,unknown,Bangla Oppn leader issues 'fatwa' against judges
169,20010104,unknown,Court reserves judgment on custody of Ilyasi's daughter
170,20010104,unknown,String theory set to become one of hottest pieces of physics
171,20010104,unknown,Hawking set to inspire science glitterati
172,20010104,unknown,Mission for technology education; more funds for R&D
173,20010104,unknown,Mission for technology education; more funds for R&D
174,20010104,unknown,Mental illness can pass from parent to child
175,20010104,unknown,Cholera outbreak source traced
176,20010104,unknown,Mathematics permeates human civilisation
177,20010104,unknown,The string that pulled Stephen Hawking to India
178,20010104,unknown,Vajpayee gives big push to tech education; R&D
179,20010104,unknown,Norms for private role in banking tightened
180,20010104,unknown,A Maha Kumbh of media players
181,20010104,unknown,Net lottery: A winner or a sucker?
182,20010104,unknown,Us and the PM's Musings
183,20010104,unknown,Milosevic to be charged with 'abuse of office'
184,20010104,unknown,Tabu: Bar Bar Dekho
185,20010104,unknown,Anupam Kher: Sliver Spoon!
186,20010104,unknown,Aftab Shivdasani: Career Cares!
187,20010104,unknown,Court reserves judgment on custody of Ilyasi's daughter
188,20010104,unknown,A museum far from the madding crowds
189,20010104,unknown,Four more Iranians admit to role in serial murders
190,20010104,unknown,Bangla Oppn leader issues 'fatwa' against judges
191,20010104,unknown,String theory set to become one of hottest pieces of physics
192,20010104,unknown,Hawking set to inspire science glitterati
193,20010104,unknown,Mission for technology education; more funds for R&D
194,20010104,unknown,Mental illness can pass from parent to child
195,20010104,unknown,Cholera outbreak source traced
196,20010104,unknown,Mathematics permeates human civilisation
197,20010104,unknown,Bangla Oppn leader issues 'fatwa' against judges
198,20010104,unknown,Bangladesh govt asks for Hamoodur Rahman report
199,20010104,unknown,Bangladesh 'scrutinising' citizen's death in US embassy
200,20010104,unknown,Hollywood posts record 9th year of box office gains
201,20010104,unknown,Great loss to Indian racing
202,20010104,unknown,The saga of Usha Stud Farm
203,20010104,unknown,Red Radior wins Victory Zone Cup
204,20010104,unknown,Race put off
205,20010104,unknown,Basu gives call to stop infighting
206,20010104,unknown,Violence mar Mamata's meeting in Midnapore
207,20010104,unknown,CPT to have new pilot system by Jan 15
208,20010104,unknown,Film industry concerned about piracy
209,20010104,unknown,City drainage system being modernised
210,20010104,unknown,Keeping the Gandhian dream alive
211,20010104,unknown,An archaeologist par excellence
212,20010104,unknown,Education body overshoots self-imposed deadline
213,20010104,unknown,PIL urges to seek flood relief from UN
214,20010104,unknown,Sen urges country to exploit its tourism potential
215,20010104,unknown,CMC to issue notice to builder
216,20010104,unknown,World govt touted as solution to crises
217,20010104,unknown,ASI team digs up part of Fatehpur Sikri
218,20010104,unknown,Lara joins elite club
219,20010104,unknown,Cullinan hits fourth Newlands hundred
220,20010104,unknown,Cronje case behind low cricket match attendance
221,20010104,unknown,Indian refusal cost PCB 2.4 cr
222,20010104,unknown,Das ready to face the short-pitch stuff
223,20010104,unknown,Haldipur; Lahiri in good stand
224,20010104,unknown,DU North Zone inter-varsity cricket champions
225,20010104,unknown,Kolkata gears up for Millennium Cup
226,20010104,unknown,Right choice is the key; says Iranian coach
227,20010104,unknown,Rajasthan lose lead and match
228,20010104,unknown,Hockey hopes rest on flowerin talent
229,20010104,unknown,Anand may get Padmabhushan
230,20010104,unknown,Emotion-choked Chennai showers love on Anand
231,20010104,unknown,Close battle for Mahindra Golfer; 2001
232,20010104,unknown,Indian Blues off to a good start
233,20010104,unknown,Ramgarh beat Royal Kashmir in Hanut Cup polo
234,20010104,unknown,Anand may get Padmabhushan
235,20010104,unknown,Cullinan hits fourth Newlands hundred
236,20010104,unknown,Ex-mayor takes up cudgels against Kothrud garbage depot
237,20010104,unknown,India is no IT superpower
238,20010104,unknown,A clean sweep
239,20010104,unknown,The Sphinx can act too
240,20010104,unknown,Giving audio-video education a cutting edge
241,20010104,unknown,Govt orders study of river diversion
242,20010104,unknown,Govt bears burden as VIPs throng Goa
243,20010104,unknown,Goa told to start quick-growth coconut project
244,20010104,unknown,Experts discuss horticulture development
245,20010104,unknown,5 acquitted in trespassing case
246,20010104,unknown,Development of horticulture stressed
247,20010104,unknown,New office-bearers for ICSI
248,20010104,unknown,CM to review security for Premji; Murthy
249,20010104,unknown,Govt allots UKP project to KPC
250,20010104,unknown,Star hotels in city get tech-savvy
251,20010104,unknown,When principals wed
252,20010104,unknown,Misbehaving conductors face action
253,20010104,unknown,Pubs are on the watch for violence
254,20010104,unknown,Celestial show awaits aircraft lovers
255,20010104,unknown,Kannada organisations oppose felicitating Nedumaran
256,20010104,unknown,Civic polls: Minister refutes BJP charges
257,20010104,unknown,Oh; for that black & white magic!
258,20010104,unknown,No clue about kidnapped boy
259,20010104,unknown,New year hash: They paid Rs 18;000; went hungry
260,20010104,unknown,5;000 anganwadis to get buildings
261,20010104,unknown,Cops shoot at sandalwood smugglers; nab one
262,20010104,unknown,Tribute-paying ritual for Patel today
263,20010104,unknown,A life snuffed out needlessly
264,20010104,unknown,PM arriving on a 2-day visit
265,20010104,unknown,Make mysterious kidnap drama secret public
266,20010104,unknown,Pollution makes these residents see red
267,20010104,unknown,Behind the walls; it's celebration time
268,20010104,unknown,Corporate cricket has lot of scope
269,20010104,unknown,An art gallery for the underprivileged
270,20010104,unknown,Annual Infant Jesus feast from Jan 14
271,20010104,unknown,Ex-Karnataka HC judge visits Bahrain
272,20010104,india,Dudhwa tiger died of starvation; not poisoning
273,20010104,city.bengaluru,Three in race for chief secy's post
274,20010104,city.patna,Druggists' stir leads to shortage of medicines
275,20010104,business.india-business,Car dealers caught in Bihar sales tax ruling
276,20010104,entertainment.english.hollywood,Space Cowboys
277,20010104,city.bengaluru,He's not so inscrutable
278,20010104,city.delhi,DPCC stages Nyay rally
279,20010104,entertainment.english.hollywood,Unbreakable
280,20010105,unknown,Light combat craft takes India into club class
281,20010105,unknown,Hawkings' day out
282,20010105,unknown,Light combat craft takes India into club class
283,20010105,unknown,Easy drugs at raves keep Goa hot on tourist circuit
284,20010105,unknown,CM defends grant to Chaturang
285,20010105,unknown,Faleiro vows to fight common cadre proposal
286,20010105,unknown,Sawant questions casino licences
287,20010105,unknown,MPT posts good show in 2000
288,20010105,unknown,Ex-GPCC chief against separate cadre
289,20010105,unknown,Meeting to review anti-defection law
290,20010105,unknown,Telecom team win play contest
291,20010105,unknown,Guala Closures bags ISO 9002 certificate
292,20010105,unknown,Bush names Lindsey top economic aide
293,20010105,unknown,Bush names Lindsey top economic aide
294,20010105,unknown,Indian American boy confesses to parents' murder
295,20010105,unknown,Anti-immigration think-tank berates Clinton regime
296,20010105,unknown,Sikh teacher guilty of assaulting student
297,20010105,unknown,Australia; New Zealand urged to accept Indo-Fijian refugees
298,20010105,unknown,If Rabuka can go free; why not us: Speight partner
299,20010105,unknown,Tailor Sam's famous clientele
300,20010105,unknown,Malaysian medics testify about demonstrators' injuries
301,20010105,unknown,Philippine soldiers arrest bombing suspects
302,20010105,unknown,Chinese stranded in Dhaka repatriated
303,20010105,unknown,It's long haul yet for the LCA
304,20010105,unknown,Captain Courageous says dream has come true
305,20010105,unknown,LCA to be good enough for next 45 yrs
306,20010105,unknown,LCA to be top in avionics; strike capability
307,20010105,unknown,Light combat craft takes India into club class
308,20010105,unknown,Hawkings' day out
309,20010105,unknown,Easy drugs at raves keep Goa hot on tourist circuit
310,20010105,unknown,CM defends grant to Chaturang
311,20010105,unknown,Faleiro vows to fight common cadre proposal
312,20010105,unknown,Sawant questions casino licences
313,20010105,unknown,MPT posts good show in 2000
314,20010105,unknown,Ex-GPCC chief against separate cadre
315,20010105,unknown,Meeting to review anti-defection law
316,20010105,unknown,Telecom team win play contest
317,20010105,unknown,Guala Closures bags ISO 9002 certificate
318,20010105,unknown,Bush names Lindsey top economic aide
319,20010105,unknown,Bush names Lindsey top economic aide
320,20010105,unknown,Indian American boy confesses to parents' murder
321,20010105,unknown,Indian American boy confesses to parents' murder
322,20010105,unknown,Anti-immigration think-tank berates Clinton regime
323,20010105,unknown,Sikh teacher guilty of assaulting student
324,20010105,unknown,Australia; New Zealand urged to accept Indo-Fijian refugees
325,20010105,unknown,If Rabuka can go free; why not us: Speight partner
326,20010105,unknown,Tailor Sam's famous clientele
327,20010105,unknown,Malaysian medics testify about demonstrators' injuries
328,20010105,unknown,Philippine soldiers arrest bombing suspects
329,20010105,unknown,Chinese stranded in Dhaka repatriated
330,20010105,unknown,Light combat craft takes India into club class
331,20010105,unknown,It's long haul yet for the LCA
332,20010105,unknown,Captain Courageous says dream has come true
333,20010105,unknown,LCA to be good enough for next 45 yrs
334,20010105,unknown,LCA to be top in avionics; strike capability
335,20010105,unknown,CM asks KPTC to keep power tariff hike in abeyance
336,20010105,unknown,Gowda and Hegde share dais; but fail to talk
337,20010105,unknown,This cactus is all set to break records
338,20010105,unknown,Function can't be stopped: Kharge
339,20010105,unknown,Think twice before you make a wish
340,20010105,unknown,LCA: Best weapon system for close combat
341,20010105,unknown,LCA test flight puts India in exclusive club
342,20010105,unknown,A dream-come-true for LCA pilot
343,20010105,unknown,Avionics provides multi-role capability to LCA
344,20010105,unknown,Hoax bomb call sends family into a tizzy
345,20010105,unknown,Govt order on dismantling Hampi bridge stayed
346,20010105,unknown,Principals of PU colleges to meet on Jan. 7
347,20010105,unknown,CM meets Sonia at airport
348,20010105,unknown,Tributes paid to Patel
349,20010105,unknown,I am a great fan of Sridevi: Prema
350,20010105,unknown,This chef knows his yin from yang
351,20010105,unknown,Wait; wait... for the bus that never comes
352,20010105,unknown,Taal se taal mila
353,20010105,unknown,Light combat craft takes India into club class
354,20010105,unknown,Hawkings' day out
355,20010105,unknown,Easy drugs at raves keep Goa hot on tourist circuit
356,20010105,unknown,CM defends grant to Chaturang
357,20010105,unknown,Sawant questions casino licences
358,20010105,unknown,MPT posts good show in 2000
359,20010105,unknown,Ex-GPCC chief against separate cadre
360,20010105,unknown,Meeting to review anti-defection law
361,20010105,unknown,Guala Closures bags ISO 9002 certificate
362,20010105,unknown,Bush names Lindsey top economic aide
363,20010105,unknown,Bush names Lindsey top economic aide
364,20010105,unknown,Indian American boy confesses to parents' murder
365,20010105,unknown,Anti-immigration think-tank berates Clinton regime
366,20010105,unknown,Sikh teacher guilty of assaulting student
367,20010105,unknown,Australia; New Zealand urged to accept Indo-Fijian refugees
368,20010105,unknown,If Rabuka can go free; why not us: Speight partner
369,20010105,unknown,Tailor Sam's famous clientele
370,20010105,unknown,Malaysian medics testify about demonstrators' injuries
371,20010105,unknown,Philippine soldiers arrest bombing suspects
372,20010105,unknown,Chinese stranded in Dhaka repatriated
373,20010105,unknown,Light combat craft takes India into club class
374,20010105,unknown,It's long haul yet for the LCA
375,20010105,unknown,Captain Courageous says dream has come true
376,20010105,unknown,LCA to be good enough for next 45 yrs
377,20010105,unknown,LCA to be top in avionics; strike capability
378,20010105,unknown,CM asks KPTC to keep power tariff hike in abeyance
379,20010105,unknown,Gowda and Hegde share dais; but fail to talk
380,20010105,unknown,This cactus is all set to break records
381,20010105,unknown,Function can't be stopped: Kharge
382,20010105,unknown,Think twice before you make a wish
383,20010105,unknown,LCA: Best weapon system for close combat
384,20010105,unknown,LCA will be aircraft for next 45 years
385,20010105,unknown,LCA test flight puts India in exclusive club
386,20010105,unknown,A dream-come-true for LCA pilot
387,20010105,unknown,Avionics provides multi-role capability to LCA
388,20010105,unknown,Hoax bomb call sends family into a tizzy
389,20010105,unknown,Govt order on dismantling Hampi bridge stayed
390,20010105,unknown,Principals of PU colleges to meet on Jan. 7
391,20010105,unknown,CM meets Sonia at airport
392,20010105,unknown,Tributes paid to Patel
393,20010105,unknown,I am a great fan of Sridevi: Prema
394,20010105,unknown,This chef knows his yin from yang
395,20010105,unknown,Wait; wait... for the bus that never comes
396,20010105,unknown,Taal se taal mila
397,20010105,unknown,Mahalakshmi Layout: Crumbling past; rapid growth
398,20010105,unknown,'We're waiting for people with money'
399,20010105,unknown,An actress and many other things besides
400,20010105,unknown,Mobile isn't a phone but a fun machine now
401,20010105,unknown,Time to bow out for 14 top bureaucrats
402,20010105,unknown,Silk is sexy this year
403,20010105,unknown,Seeds firm condemns hooliganism
404,20010105,edit-page,Nepal won't allow anti-India activities: Envoy
405,20010105,india,MP best in forest development: Centre
406,20010106,unknown,Light combat craft takes India into club class
407,20010106,unknown,Hawkings' day out
408,20010106,unknown,Ex-GPCC chief against separate cadre
409,20010106,unknown,Meeting to review anti-defection law
410,20010106,unknown,Telecom team win play contest
411,20010106,unknown,Guala Closures bags ISO 9002 certificate
412,20010106,unknown,Bush names Lindsey top economic aide
413,20010106,unknown,Bush names Lindsey top economic aide
414,20010106,unknown,Indian American boy confesses to parents' murder
415,20010106,unknown,Anti-immigration think-tank berates Clinton regime
416,20010106,unknown,Sikh teacher guilty of assaulting student
417,20010106,unknown,Australia; New Zealand urged to accept Indo-Fijian refugees
418,20010107,unknown,Muslim body rules out talks on Ayodhya
419,20010107,unknown,Bajrang Dal blows hot; cold
420,20010107,unknown,Vajpayee rejects Nitish's resignation
421,20010107,unknown,PM taps diaspora to realise Indian ambition
422,20010107,unknown,India cagey about food imports
423,20010107,unknown,US leggy chicks to come in hordes
424,20010107,unknown,Microsoft; Intel line up top-end products for electronics show
425,20010107,unknown,Khosla among Upside's 25 people to watch in 2001
426,20010107,unknown,Spending on Net projects may be hit
427,20010107,unknown,British doctor may be worst mass murderer in modern history
428,20010107,unknown,British judge reveals threats from racists
429,20010107,unknown,Clinton urges US Congress to ratify CTBT
430,20010107,unknown,Blind climber to scale Mt. Everest
431,20010107,unknown,Does American TV have a realism overdose?
432,20010107,unknown,Banking community must chalk out new system: Jalan
433,20010107,unknown,Delhi to host India-EU working group meeting on IT
